<?xml version="1.0"?>
<?mso-application progid="Excel.Sheet"?>
<Workbook xmlns="urn:schemas-microsoft-com:office:spreadsheet"
 xmlns:o="urn:schemas-microsoft-com:office:office"
 xmlns:x="urn:schemas-microsoft-com:office:excel"
 xmlns:ss="urn:schemas-microsoft-com:office:spreadsheet"
 xmlns:html="http://www.w3.org/TR/REC-html40">
 <DocumentProperties xmlns="urn:schemas-microsoft-com:office:office">
  <LastAuthor>John Margotti</LastAuthor>
  <Created>2024-03-29T17:27:15Z</Created>
  <Version>16.00</Version>
 </DocumentProperties>
 <OfficeDocumentSettings xmlns="urn:schemas-microsoft-com:office:office">
  <AllowPNG/>
 </OfficeDocumentSettings>
 <ExcelWorkbook xmlns="urn:schemas-microsoft-com:office:excel">
  <WindowHeight>12010</WindowHeight>
  <WindowWidth>32767</WindowWidth>
  <WindowTopX>32767</WindowTopX>
  <WindowTopY>32767</WindowTopY>
  <ProtectStructure>False</ProtectStructure>
  <ProtectWindows>False</ProtectWindows>
 </ExcelWorkbook>
 <Styles>
  <Style ss:ID="Default" ss:Name="Normal">
   <Alignment ss:Vertical="Bottom"/>
   <Borders/>
   <Font ss:FontName="Aptos Narrow" x:Family="Swiss" ss:Size="11"
    ss:Color="#000000"/>
   <Interior/>
   <NumberFormat/>
   <Protection/>
  </Style>
  <Style ss:ID="s62">
   <NumberFormat ss:Format="Short Date"/>
  </Style>
  <Style ss:ID="s63">
   <Alignment ss:Vertical="Bottom" ss:WrapText="1"/>
  </Style>
 </Styles>
 <Worksheet ss:Name="New York Post - New Hires ">
  <Table ss:ExpandedColumnCount="7" ss:ExpandedRowCount="327" x:FullColumns="1"
   x:FullRows="1" ss:DefaultRowHeight="14.5">
   <Column ss:AutoFitWidth="0" ss:Width="212.5"/>
   <Column ss:AutoFitWidth="0" ss:Width="139.5"/>
   <Column ss:AutoFitWidth="0" ss:Width="144"/>
   <Row>
    <Cell ss:StyleID="s62"><Data ss:Type="DateTime">2022-01-18T00:00:00.000</Data></Cell>
    <Cell><Data ss:Type="String">SCTASK0074074</Data></Cell>
    <Cell><Data ss:Type="String">Evan Simko</Data></Cell>
    <Cell ss:Index="6" ss:StyleID="s62"><Data ss:Type="DateTime">2022-01-14T00:00:00.000</Data></Cell>
    <Cell><Data ss:Type="String">Start Date: Tuesday January 18, 2022 - Created the account 01-06-2022 - Just waiting for the LDAP to complete this. - Completed 01-14-2022 - ***Emailed Evan - 01-18-2022***</Data></Cell>
   </Row>
   <Row>
    <Cell ss:StyleID="s62"><Data ss:Type="DateTime">2022-01-12T00:00:00.000</Data></Cell>
    <Cell><Data ss:Type="String">N/A</Data></Cell>
    <Cell><Data ss:Type="String">Dexter Henry</Data></Cell>
    <Cell ss:Index="7"><Data ss:Type="String">As per Warren Cohen - No Adobe is needed.</Data></Cell>
   </Row>
   <Row>
    <Cell ss:StyleID="s62"><Data ss:Type="DateTime">2022-01-17T00:00:00.000</Data></Cell>
    <Cell><Data ss:Type="String">N/A</Data></Cell>
    <Cell><Data ss:Type="String">Hailey Eber</Data></Cell>
    <Cell ss:Index="7"><Data ss:Type="String">Hailey Eber is moving to full-time on 1/17/22 - ***No email needed. She is already working here. Just moved to a FT employee***.</Data></Cell>
   </Row>
   <Row>
    <Cell ss:StyleID="s62"><Data ss:Type="DateTime">2022-01-12T00:00:00.000</Data></Cell>
    <Cell><Data ss:Type="String">SCTASK0073287</Data></Cell>
    <Cell><Data ss:Type="String">Michael Sorace </Data></Cell>
    <Cell><Data ss:Type="String"> msorace@nypost.com </Data></Cell>
    <Cell ss:Index="6" ss:StyleID="s62"><Data ss:Type="DateTime">2022-01-13T00:00:00.000</Data></Cell>
    <Cell><Data ss:Type="String">Request #: 5244 - ***Email sent***</Data></Cell>
   </Row>
   <Row>
    <Cell ss:StyleID="s62"><Data ss:Type="DateTime">2022-01-24T00:00:00.000</Data></Cell>
    <Cell><Data ss:Type="String">SCTASK0073291</Data></Cell>
    <Cell><Data ss:Type="String">Rebecca Isaacs </Data></Cell>
    <Cell><Data ss:Type="String"> risaacs@decider.com </Data></Cell>
    <Cell ss:Index="6" ss:StyleID="s62"><Data ss:Type="DateTime">2022-01-13T00:00:00.000</Data></Cell>
    <Cell><Data ss:Type="String">Waiting for the email to change from nypost.com to decider.com - Need to add Adobe to Okta to complete the request. Already added Adobe Acrobat Pro and Adobe Photshop to her account. ***Need to email her***</Data></Cell>
   </Row>
   <Row>
    <Cell ss:StyleID="s62"><Data ss:Type="DateTime">2022-01-24T00:00:00.000</Data></Cell>
    <Cell><Data ss:Type="String">SCTASK0077563</Data></Cell>
    <Cell><Data ss:Type="String">Shivani Reddy </Data></Cell>
    <Cell><Data ss:Type="String"> smanjunath.intern@decider.com </Data></Cell>
    <Cell><Data ss:Type="String"> Mac </Data></Cell>
    <Cell ss:StyleID="s62"><Data ss:Type="DateTime">2022-01-24T00:00:00.000</Data></Cell>
    <Cell><Data ss:Type="String">Accounts created - emailed the user on January 24th</Data></Cell>
   </Row>
   <Row>
    <Cell ss:StyleID="s62"><Data ss:Type="DateTime">2022-01-24T00:00:00.000</Data></Cell>
    <Cell><Data ss:Type="String">SCTASK0077564</Data></Cell>
    <Cell><Data ss:Type="String">Brittany Miller </Data></Cell>
    <Cell><Data ss:Type="String"> bmiller.intern@nypost.com </Data></Cell>
    <Cell><Data ss:Type="String"> Mac</Data></Cell>
    <Cell ss:StyleID="s62"><Data ss:Type="DateTime">2022-01-24T00:00:00.000</Data></Cell>
    <Cell><Data ss:Type="String">Accounts created - emailed the user on January 24th</Data></Cell>
   </Row>
   <Row>
    <Cell ss:StyleID="s62"><Data ss:Type="DateTime">2022-01-24T00:00:00.000</Data></Cell>
    <Cell><Data ss:Type="String">SCTASK0077567</Data></Cell>
    <Cell><Data ss:Type="String">Jenna Wirth </Data></Cell>
    <Cell><Data ss:Type="String"> jwirth.intern@decider.com </Data></Cell>
    <Cell><Data ss:Type="String"> Mac</Data></Cell>
    <Cell ss:StyleID="s62"><Data ss:Type="DateTime">2022-01-24T00:00:00.000</Data></Cell>
    <Cell><Data ss:Type="String">Accounts created - emailed the user on January 24th</Data></Cell>
   </Row>
   <Row>
    <Cell ss:StyleID="s62"><Data ss:Type="DateTime">2022-01-24T00:00:00.000</Data></Cell>
    <Cell><Data ss:Type="String">SCTASK0077568</Data></Cell>
    <Cell><Data ss:Type="String">Neha Seenarine </Data></Cell>
    <Cell><Data ss:Type="String"> nseenarine.intern@decider.com </Data></Cell>
    <Cell><Data ss:Type="String"> Mac</Data></Cell>
    <Cell ss:StyleID="s62"><Data ss:Type="DateTime">2022-01-24T00:00:00.000</Data></Cell>
    <Cell><Data ss:Type="String">Accounts created - emailed the user on January 24th</Data></Cell>
   </Row>
   <Row>
    <Cell ss:StyleID="s62"><Data ss:Type="DateTime">2022-01-24T00:00:00.000</Data></Cell>
    <Cell><Data ss:Type="String">SCTASK0077569</Data></Cell>
    <Cell><Data ss:Type="String">Dianna Shen </Data></Cell>
    <Cell><Data ss:Type="String"> dshen.intern@decider.com </Data></Cell>
    <Cell><Data ss:Type="String"> Mac</Data></Cell>
    <Cell ss:StyleID="s62"><Data ss:Type="DateTime">2022-01-24T00:00:00.000</Data></Cell>
    <Cell><Data ss:Type="String">Accounts created - emailed the user on January 24th</Data></Cell>
   </Row>
   <Row>
    <Cell ss:StyleID="s62"><Data ss:Type="DateTime">2022-01-24T00:00:00.000</Data></Cell>
    <Cell><Data ss:Type="String">SCTASK0077570</Data></Cell>
    <Cell><Data ss:Type="String">Jami Ellen </Data></Cell>
    <Cell><Data ss:Type="String"> jellen.intern@decider.com </Data></Cell>
    <Cell><Data ss:Type="String"> Mac</Data></Cell>
    <Cell ss:StyleID="s62"><Data ss:Type="DateTime">2022-01-24T00:00:00.000</Data></Cell>
    <Cell><Data ss:Type="String">Accounts created - emailed the user on January 24th</Data></Cell>
   </Row>
   <Row>
    <Cell ss:StyleID="s62"><Data ss:Type="DateTime">2022-01-31T00:00:00.000</Data></Cell>
    <Cell><Data ss:Type="String">SCTASK0081278</Data></Cell>
    <Cell><Data ss:Type="String">Samuel Munson </Data></Cell>
    <Cell><Data ss:Type="String"> smunson@nypost.com </Data></Cell>
    <Cell><Data ss:Type="String"> PC</Data></Cell>
    <Cell ss:StyleID="s62"><Data ss:Type="DateTime">2022-01-31T00:00:00.000</Data></Cell>
    <Cell><Data ss:Type="String">Emailed the customer login and access info. Copied Peggy Mo in the email.</Data></Cell>
   </Row>
   <Row>
    <Cell ss:StyleID="s62"><Data ss:Type="DateTime">2022-02-03T00:00:00.000</Data></Cell>
    <Cell><Data ss:Type="String">SCTASK0083711</Data></Cell>
    <Cell><Data ss:Type="String">Griffin Kelly </Data></Cell>
    <Cell><Data ss:Type="String"> gkelly@nypost.com </Data></Cell>
    <Cell><Data ss:Type="String"> PC</Data></Cell>
    <Cell ss:StyleID="s62"><Data ss:Type="DateTime">2022-02-03T00:00:00.000</Data></Cell>
    <Cell><Data ss:Type="String">Emailed the customer login and access info. Copied Peggy Mo in the email.</Data></Cell>
   </Row>
   <Row>
    <Cell ss:StyleID="s62"><Data ss:Type="DateTime">2022-02-07T00:00:00.000</Data></Cell>
    <Cell><Data ss:Type="String">SCTASK0085280</Data></Cell>
    <Cell><Data ss:Type="String">MaryAnn Martinez </Data></Cell>
    <Cell><Data ss:Type="String"> mmartinez@nypost.com </Data></Cell>
    <Cell><Data ss:Type="String"> Mac</Data></Cell>
    <Cell ss:Index="7"><Data ss:Type="String">Emailed the customer login and access info. Copied Peggy Mo in the email. February 7, 2022</Data></Cell>
   </Row>
   <Row>
    <Cell ss:StyleID="s62"><Data ss:Type="DateTime">2022-02-07T00:00:00.000</Data></Cell>
    <Cell><Data ss:Type="String">SCTASK0085282</Data></Cell>
    <Cell><Data ss:Type="String">EmmaKate Austin </Data></Cell>
    <Cell><Data ss:Type="String"> eaustin@nypost.com </Data></Cell>
    <Cell><Data ss:Type="String"> Mac</Data></Cell>
    <Cell ss:Index="7"><Data ss:Type="String">Emailed the customer login and access info. Copied Peggy Mo in the email. February 7, 2022</Data></Cell>
   </Row>
   <Row>
    <Cell ss:StyleID="s62"><Data ss:Type="DateTime">2022-02-07T00:00:00.000</Data></Cell>
    <Cell><Data ss:Type="String">SCTASK0085284</Data></Cell>
    <Cell><Data ss:Type="String">Ryan Sampson </Data></Cell>
    <Cell><Data ss:Type="String"> rsampson@nypost.com </Data></Cell>
    <Cell><Data ss:Type="String"> Mac</Data></Cell>
    <Cell ss:Index="7"><Data ss:Type="String">Emailed the customer login and access info. Copied Peggy Mo in the email. February 7, 2022</Data></Cell>
   </Row>
   <Row>
    <Cell ss:StyleID="s62"><Data ss:Type="DateTime">2022-02-07T00:00:00.000</Data></Cell>
    <Cell><Data ss:Type="String">SCTASK0085285</Data></Cell>
    <Cell><Data ss:Type="String">Thomas Hogan </Data></Cell>
    <Cell><Data ss:Type="String"> thogan@nypost.com </Data></Cell>
    <Cell><Data ss:Type="String"> Mac</Data></Cell>
    <Cell ss:Index="7"><Data ss:Type="String">Emailed the customer login and access info. Copied Peggy Mo in the email. February 7, 2022</Data></Cell>
   </Row>
   <Row>
    <Cell ss:StyleID="s62"><Data ss:Type="DateTime">2022-02-15T00:00:00.000</Data></Cell>
    <Cell><Data ss:Type="String">SCTASK0089733</Data></Cell>
    <Cell><Data ss:Type="String">Kristin Contino </Data></Cell>
    <Cell><Data ss:Type="String"> kcontino@nypost.com</Data></Cell>
    <Cell ss:Index="6" ss:StyleID="s62"><Data ss:Type="DateTime">2022-01-10T00:00:00.000</Data></Cell>
    <Cell><Data ss:Type="String">Start date was changed to February 15, 2022 as per Peggy Mo's email. - I emailed Kristin the instructions to access Adobe CC and Photoshop - 02-15-2022 - 9:46 AM</Data></Cell>
   </Row>
   <Row>
    <Cell ss:StyleID="s62"><Data ss:Type="DateTime">2022-02-22T00:00:00.000</Data></Cell>
    <Cell><Data ss:Type="String">SCTASK0092647</Data></Cell>
    <Cell><Data ss:Type="String">Margaret Abrams </Data></Cell>
    <Cell><Data ss:Type="String"> mabrams@nypost.com </Data></Cell>
    <Cell><Data ss:Type="String"> Mac</Data></Cell>
    <Cell ss:StyleID="s62"><Data ss:Type="DateTime">2022-02-17T00:00:00.000</Data></Cell>
    <Cell><Data ss:Type="String">Margaret Abrams is starting 2/22/2022. Please activate all nypost accounts and model after Kristin Contino. She will only need Adobe Photoshop which she uses a Mac. - Account Created 02-17-2022 - Need to email the user on the start date.</Data></Cell>
   </Row>
   <Row>
    <Cell ss:StyleID="s62"><Data ss:Type="DateTime">2022-02-22T00:00:00.000</Data></Cell>
    <Cell><Data ss:Type="String">SCTASK0092636</Data></Cell>
    <Cell><Data ss:Type="String">Nicole Mazza </Data></Cell>
    <Cell><Data ss:Type="String"> nmazza@nypost.com </Data></Cell>
    <Cell><Data ss:Type="String"> Mac</Data></Cell>
    <Cell ss:StyleID="s62"><Data ss:Type="DateTime">2022-02-17T00:00:00.000</Data></Cell>
    <Cell><Data ss:Type="String">We have Nicole Mazza starting on Tuesday, 2/22. She's not in SN, so I wasn't able to submit a ticket. Macbook Pro 13&quot;, Monitor - Account Created 02-17-2022 - Need to email the user on the start date.</Data></Cell>
   </Row>
   <Row>
    <Cell ss:StyleID="s62"><Data ss:Type="DateTime">2022-02-22T00:00:00.000</Data></Cell>
    <Cell><Data ss:Type="String">SCTASK0092645</Data></Cell>
    <Cell><Data ss:Type="String">Jeff Stansbury </Data></Cell>
    <Cell><Data ss:Type="String"> jstansbury@nypost.com </Data></Cell>
    <Cell><Data ss:Type="String"> Mac</Data></Cell>
    <Cell ss:Index="7"><Data ss:Type="String">We have&#160;Jeff Stansbury&#160;starting on&#160;Tuesday, 2/22.&#160;He's not in SN so I wasn't able to submit a ticket. His WD ID is 235423. - Emailed the user - 02-22-2022 - 8:58 AM.</Data></Cell>
   </Row>
   <Row>
    <Cell ss:StyleID="s62"><Data ss:Type="DateTime">2022-02-22T00:00:00.000</Data></Cell>
    <Cell><Data ss:Type="String">SCTASK0092639</Data></Cell>
    <Cell><Data ss:Type="String">Alyssa Hargrove </Data></Cell>
    <Cell><Data ss:Type="String"> ahargrove@nypost.com </Data></Cell>
    <Cell><Data ss:Type="String"> Mac</Data></Cell>
    <Cell ss:Index="7"><Data ss:Type="String">Alyssa Hargrove's first day is 2/22/22.  Please activate all nypost accounts and model after Pankaj Khadka. For equipment, she'll need a Macbook Pro 13&quot; and Monitor. For softwares, she'll need Merlin, photoshop, and bridge. Email sent 02-22-2022 - 8:59 AM.</Data></Cell>
   </Row>
   <Row>
    <Cell ss:StyleID="s62"><Data ss:Type="DateTime">2022-02-22T00:00:00.000</Data></Cell>
    <Cell><Data ss:Type="String">SCTASK0094245\SCTASK0094820</Data></Cell>
    <Cell><Data ss:Type="String">Jon Helmkamp </Data></Cell>
    <Cell><Data ss:Type="String"> jhelmkamp@nypost.com </Data></Cell>
    <Cell><Data ss:Type="String"> Mac</Data></Cell>
    <Cell ss:Index="7"><Data ss:Type="String">Jon Helmkamp started on 2/22/2022. His account is activated. He will need Macbook Pro 13&quot;. For softwares, he'll need Methode, Merlin, &#160;Adobe Photoshop. Please model after Mike Blinn. (Emailed the user Feb 25th and March 1st.)</Data></Cell>
   </Row>
   <Row>
    <Cell ss:StyleID="s62"><Data ss:Type="DateTime">2022-02-28T00:00:00.000</Data></Cell>
    <Cell><Data ss:Type="String">SCTASK0094245\SCTASK0096285</Data></Cell>
    <Cell><Data ss:Type="String">Adriana Diaz </Data></Cell>
    <Cell><Data ss:Type="String"> adiaz@nypost.com </Data></Cell>
    <Cell><Data ss:Type="String"> PC </Data></Cell>
    <Cell ss:Index="7"><Data ss:Type="String">Adriana Diaz's first day back is 2/28/2022. Please activate all nypost accounts and model after Alex Mitchell. For softwares, Slack, WordPress, AirTable, Methode, Merlin, Photoshop. (Emailed at 12:30 PM - 03-01-2022.)</Data></Cell>
   </Row>
   <Row>
    <Cell ss:StyleID="s62"><Data ss:Type="DateTime">2022-03-01T00:00:00.000</Data></Cell>
    <Cell><Data ss:Type="String">SCTASK0094245\SCTASK0094249</Data></Cell>
    <Cell><Data ss:Type="String">Brian Wacker </Data></Cell>
    <Cell><Data ss:Type="String"> bwacker@nypost.com </Data></Cell>
    <Cell><Data ss:Type="String"> PC</Data></Cell>
    <Cell ss:Index="7"><Data ss:Type="String">Brian Wacker's first day is 3/1/22, but will attend orientation on 2/28/22. For software, he'll need Methode, Merlin, Photoshop, Office, WordPress. (Email sent out - 02-24-2022 and again 03-01-2022.)</Data></Cell>
   </Row>
   <Row>
    <Cell ss:StyleID="s62"><Data ss:Type="DateTime">2022-02-25T00:00:00.000</Data></Cell>
    <Cell><Data ss:Type="String">SCTASK0094829\SCTASK0094832</Data></Cell>
    <Cell><Data ss:Type="String">Erin Keller </Data></Cell>
    <Cell><Data ss:Type="String"> ekeller@nypost.com </Data></Cell>
    <Cell><Data ss:Type="String"> Mac</Data></Cell>
    <Cell ss:Index="7"><Data ss:Type="String">Softwares: Merlin, Adobe Photoshop, Methode, Slack, WordPress, Storyful, Parsley, Getty, AP/AP Images, Security Keeper, Brightcove, Gmail, OKTA. (Email sent out Feb 25th.)</Data></Cell>
   </Row>
   <Row>
    <Cell ss:StyleID="s62"><Data ss:Type="DateTime">2022-03-07T00:00:00.000</Data></Cell>
    <Cell><Data ss:Type="String">SCTASK0099160\SCTASK0099164</Data></Cell>
    <Cell><Data ss:Type="String">Erich Richter </Data></Cell>
    <Cell><Data ss:Type="String"> erichter@nypost.com </Data></Cell>
    <Cell><Data ss:Type="String"> Mac</Data></Cell>
    <Cell ss:Index="7"><Data ss:Type="String">Softwares: Methode, Merlin, Adobe Photoshop - (03-07-2021 - 1:51 AM )</Data></Cell>
   </Row>
   <Row>
    <Cell ss:StyleID="s62"><Data ss:Type="DateTime">2022-03-07T00:00:00.000</Data></Cell>
    <Cell><Data ss:Type="String">SCTASK0099160\SCTASK0099166</Data></Cell>
    <Cell><Data ss:Type="String">Jeanette Settembre </Data></Cell>
    <Cell><Data ss:Type="String"> jsettembre@nypost.com </Data></Cell>
    <Cell><Data ss:Type="String"> PC</Data></Cell>
    <Cell ss:Index="7"><Data ss:Type="String">She will need a Dell Latitude 5420. For softwares, she'll need Slack, WordPress, AirTable, Merlin, Photoshop, Microsoft Office, Keeper, GlobalConnect. (Emailed the user - 03-07-2022 -1:51 AM)</Data></Cell>
   </Row>
   <Row>
    <Cell ss:StyleID="s62"><Data ss:Type="DateTime">2022-03-07T00:00:00.000</Data></Cell>
    <Cell><Data ss:Type="String">N/A - PAS</Data></Cell>
    <Cell><Data ss:Type="String">Victoria Weinsheimer </Data></Cell>
    <Cell><Data ss:Type="String"> vweinsheimer@nypost.com </Data></Cell>
    <Cell><Data ss:Type="String"> PC</Data></Cell>
    <Cell ss:Index="7"><Data ss:Type="String">She'll need Dell Latitude 5420 and Standard monitor/mouse/keyboard. For softwares, she'll need Microsoft Office - Most recent version and GlobalProtect.&#160;</Data></Cell>
   </Row>
   <Row>
    <Cell ss:StyleID="s62"><Data ss:Type="DateTime">2022-03-07T00:00:00.000</Data></Cell>
    <Cell><Data ss:Type="String">SCTASK0099172</Data></Cell>
    <Cell><Data ss:Type="String">Bernie Zilio </Data></Cell>
    <Cell><Data ss:Type="String"> bzilio@nypost.com </Data></Cell>
    <Cell><Data ss:Type="String"> Mac</Data></Cell>
    <Cell ss:Index="7"><Data ss:Type="String">For softwares, Adobe Photoshop, Slack, and Global Protect. (Emailed The User - 03-07-2022 - 1:52 AM)</Data></Cell>
   </Row>
   <Row>
    <Cell ss:StyleID="s62"><Data ss:Type="DateTime">2022-03-14T00:00:00.000</Data></Cell>
    <Cell><Data ss:Type="String">SCTASK0102614\SCTASK0102623</Data></Cell>
    <Cell><Data ss:Type="String">Stephen Lee </Data></Cell>
    <Cell><Data ss:Type="String"> SLee@nypost.com</Data></Cell>
    <Cell ss:Index="7"><Data ss:Type="String">For softwares, he'll need Methode, Merlin, Photoshop, WordPress, Airtable, Slack, Global Protect.&#160;(All requested accounts were completed on March 8, 2022. I need to email the user.) - Emailed The user: March 14, 2022 - 9:39 AM</Data></Cell>
   </Row>
   <Row>
    <Cell ss:StyleID="s62"><Data ss:Type="DateTime">2022-03-14T00:00:00.000</Data></Cell>
    <Cell><Data ss:Type="String">SCTASK0102614</Data></Cell>
    <Cell><Data ss:Type="String">Cayla Bamberger </Data></Cell>
    <Cell><Data ss:Type="String"> cbamberger@nypost.com</Data></Cell>
    <Cell ss:Index="7"><Data ss:Type="String">For softwares, she'll need Methode, wordpress, air table, and Global Protect. (All requested accounts were completed on March 8, 2022. I need to email the user.) - Emailed the user: March 14, 2022 - 9:45 AM</Data></Cell>
   </Row>
   <Row>
    <Cell ss:StyleID="s62"><Data ss:Type="DateTime">2022-03-21T00:00:00.000</Data></Cell>
    <Cell><Data ss:Type="String">SCTASK0106125</Data></Cell>
    <Cell><Data ss:Type="String">Daniela Parfait </Data></Cell>
    <Cell><Data ss:Type="String"> dparfait@nypost.com </Data></Cell>
    <Cell><Data ss:Type="String"> PC</Data></Cell>
    <Cell ss:StyleID="s62"><Data ss:Type="DateTime">2022-03-15T00:00:00.000</Data></Cell>
    <Cell><Data ss:Type="String">Daniela Parfait's first day is 3/21/22. Please activate all nypost accounts and model after Amy Roman - For softwares, please give her the same access to the ones Amy Roman had and Global Protect.  (03-18-2022)</Data></Cell>
   </Row>
   <Row>
    <Cell ss:StyleID="s62"><Data ss:Type="DateTime">2022-03-21T00:00:00.000</Data></Cell>
    <Cell><Data ss:Type="String">SCTASK0106120</Data></Cell>
    <Cell><Data ss:Type="String">Joseph LoVerde </Data></Cell>
    <Cell><Data ss:Type="String"> jloverde@nypost.com </Data></Cell>
    <Cell><Data ss:Type="String"> PC</Data></Cell>
    <Cell ss:StyleID="s62"><Data ss:Type="DateTime">2022-03-15T00:00:00.000</Data></Cell>
    <Cell><Data ss:Type="String">Joseph LoVerde's first day is 3/21/22. Please activate all nypost accounts and model after Brayden Simms. For softwares, he'll need Methode, Merlin, and Global Protect. (03-18-2022)</Data></Cell>
   </Row>
   <Row>
    <Cell ss:StyleID="s62"><Data ss:Type="DateTime">2022-03-21T00:00:00.000</Data></Cell>
    <Cell><Data ss:Type="String">SCTASK0106129</Data></Cell>
    <Cell><Data ss:Type="String">Kayla Yoo </Data></Cell>
    <Cell><Data ss:Type="String"> kyoo@nypost.com </Data></Cell>
    <Cell><Data ss:Type="String">Mac</Data></Cell>
    <Cell ss:Index="7"><Data ss:Type="String">Kayla Yoo's first day is 3/21/22. Please activate all nypost accounts and model after Victoria Shobe.  - For softwares, she'll need Adobe Creative Suite, Acrobat, Quicktime, Slack, Global Protect.  (03-18-2022)</Data></Cell>
   </Row>
   <Row>
    <Cell ss:StyleID="s62"><Data ss:Type="DateTime">2022-03-21T00:00:00.000</Data></Cell>
    <Cell><Data ss:Type="String">SCTASK0106120</Data></Cell>
    <Cell><Data ss:Type="String">David Kaufman </Data></Cell>
    <Cell><Data ss:Type="String"> dkaufman@nypost.com </Data></Cell>
    <Cell><Data ss:Type="String"> PC</Data></Cell>
    <Cell ss:Index="7"><Data ss:Type="String">David Kaufman's first day is 3/21/22. For softwares, he'll need Methode, Merlin, AirTable, Wordpress, Global Protect, and Slack. (03-18-2022)</Data></Cell>
   </Row>
   <Row>
    <Cell ss:StyleID="s62"><Data ss:Type="DateTime">2022-03-19T00:00:00.000</Data></Cell>
    <Cell><Data ss:Type="String">SCTASK0106120</Data></Cell>
    <Cell><Data ss:Type="String">Brian Marschhauser </Data></Cell>
    <Cell><Data ss:Type="String"> bmarschhauser@nypost.com</Data></Cell>
    <Cell ss:Index="7"><Data ss:Type="String">We were just notified that Brian Marschhauser's first day is 3/19/22. For softwares, he'll need methode, slack, wordpress, air table, Global Protect. (03-18-2022)</Data></Cell>
   </Row>
   <Row>
    <Cell ss:StyleID="s62"><Data ss:Type="DateTime">2022-03-21T00:00:00.000</Data></Cell>
    <Cell><Data ss:Type="String">SCTASK0106135</Data></Cell>
    <Cell><Data ss:Type="String">Cierra Pacheco </Data></Cell>
    <Cell><Data ss:Type="String"> cpacheco@nypost.com </Data></Cell>
    <Cell><Data ss:Type="String"> Mac</Data></Cell>
    <Cell ss:Index="7"><Data ss:Type="String">Cierra Pacheco's first day is 3/21/22. Please activate all nypost accounts and model after Warren Cohen. She'll need adobe creative suite, dropbox, slack. - Approved by Levent Saracoglu -  (Email sent: 03-18-2022)</Data></Cell>
   </Row>
   <Row>
    <Cell ss:StyleID="s62"><Data ss:Type="DateTime">2022-03-21T00:00:00.000</Data></Cell>
    <Cell><Data ss:Type="String">SCTASK0106137</Data></Cell>
    <Cell><Data ss:Type="String">Mollie Kather </Data></Cell>
    <Cell><Data ss:Type="String"> mkather@nypost.com </Data></Cell>
    <Cell><Data ss:Type="String"> Mac</Data></Cell>
    <Cell ss:Index="7"><Data ss:Type="String">Mollie Kather's first day is 3/21/22. Please activate all nypost accounts and model after Warren Cohen. She'll need adobe creative suite, dropbox, slack. - Approved by Levent Saracoglu - (Email sent: 03-21-2022)</Data></Cell>
   </Row>
   <Row>
    <Cell ss:StyleID="s62"><Data ss:Type="DateTime">2022-03-21T00:00:00.000</Data></Cell>
    <Cell><Data ss:Type="String">SCTASK0106140</Data></Cell>
    <Cell><Data ss:Type="String">Nicholas Zawisha </Data></Cell>
    <Cell><Data ss:Type="String"> nzawisha@nypost.com </Data></Cell>
    <Cell><Data ss:Type="String">  Mac </Data></Cell>
    <Cell ss:Index="7"><Data ss:Type="String">Nicholas Zawisha's first day is 3/21/22. Please activate all nypost accounts and model after Warren Cohen. He'll need adobe creative suite, dropbox, slack. Approved By Levent Saracoglu - (Email sent 03-21-2022)</Data></Cell>
   </Row>
   <Row>
    <Cell ss:StyleID="s62"><Data ss:Type="DateTime">2022-03-21T00:00:00.000</Data></Cell>
    <Cell><Data ss:Type="String">SCTASK0106206</Data></Cell>
    <Cell><Data ss:Type="String">Elizabeth Morrow </Data></Cell>
    <Cell><Data ss:Type="String"> emorrow@nypost.com </Data></Cell>
    <Cell><Data ss:Type="String"> Mac</Data></Cell>
    <Cell ss:Index="7"><Data ss:Type="String">Elizabeth Morrow's first day is 3/21/22. Please activate all nypost accounts and model after Warren Cohen. She'll need adobe creative suite, dropbox, slack - Approved by Levent Saracoglu - (Email sent: 03-21-2022)</Data></Cell>
   </Row>
   <Row>
    <Cell ss:StyleID="s62"><Data ss:Type="DateTime">2022-03-28T00:00:00.000</Data></Cell>
    <Cell><Data ss:Type="String">SCTASK0107445</Data></Cell>
    <Cell><Data ss:Type="String">David Kaye </Data></Cell>
    <Cell><Data ss:Type="String"> dkaye@nypost.com </Data></Cell>
    <Cell><Data ss:Type="String"> Mac</Data></Cell>
    <Cell ss:Index="7"><Data ss:Type="String">David Kaye's first day is 3/28/22. Please activate all nypost accounts and model after Pankaj Khadka.  For softwares, he'll need Merlin, Adobe Suite, Global Protect. - Approved by Levent Saracoglu - (Email sent: 03-29-2022)</Data></Cell>
   </Row>
   <Row>
    <Cell ss:StyleID="s62"><Data ss:Type="DateTime">2022-04-03T00:00:00.000</Data></Cell>
    <Cell><Data ss:Type="String">SCTASK0112177</Data></Cell>
    <Cell><Data ss:Type="String">Michael Romano </Data></Cell>
    <Cell><Data ss:Type="String"> mromano@nypost.com </Data></Cell>
    <Cell><Data ss:Type="String"> PC</Data></Cell>
    <Cell ss:Index="7"><Data ss:Type="String">Mike Romano's first day is 4/3/22 - Please activate all nypost accounts and model after James Covert - He'll need a Dell Latitude 5420. For softwares, Methode, Merlin, WordPress, AirTable. (03-31-2022)</Data></Cell>
   </Row>
   <Row>
    <Cell ss:StyleID="s62"><Data ss:Type="DateTime">2022-03-30T00:00:00.000</Data></Cell>
    <Cell><Data ss:Type="String">SCTASK0112177</Data></Cell>
    <Cell><Data ss:Type="String">Angela Barbuti </Data></Cell>
    <Cell><Data ss:Type="String"> abarbuti@nypost.com</Data></Cell>
    <Cell ss:Index="7"><Data ss:Type="String">Angela Barbuti's first day is 3/30/22. Please activate all nypost accounts and model after Griffin Kelly.&#160;She'll need Dell Latitude 5420. For softwares, she'll need methode, slack (breaking channel) air table; wordpress. (03-31-2022)</Data></Cell>
   </Row>
   <Row>
    <Cell ss:StyleID="s62"><Data ss:Type="DateTime">2022-04-07T00:00:00.000</Data></Cell>
    <Cell><Data ss:Type="String">SCTASK0117927</Data></Cell>
    <Cell><Data ss:Type="String">Jon Heyman </Data></Cell>
    <Cell><Data ss:Type="String"> jheyman@nypost.com</Data></Cell>
    <Cell ss:Index="7"><Data ss:Type="String">For equipment, he'll need Macbook Pro 13&quot;. For softwares, he'll need Office, WordPress, Merlin, GlobalProtect. (04-08-2022).</Data></Cell>
   </Row>
   <Row>
    <Cell ss:StyleID="s62"><Data ss:Type="DateTime">2022-04-11T00:00:00.000</Data></Cell>
    <Cell><Data ss:Type="String">SCTASK0118986</Data></Cell>
    <Cell><Data ss:Type="String">Hannah Sulcov </Data></Cell>
    <Cell><Data ss:Type="String"> hsulcov@nypost.com</Data></Cell>
    <Cell ss:Index="7"><Data ss:Type="String">Hannah Sulcov's first day is 4/11/22. Please activate all nypost accounts and model after Maggie Sposato. She'll need Macbook Pro 13&quot;. For softwares, she'll need Adobe Photoshop, Adobe Rush, and Global Protect. (Email sent 04-11-2022)</Data></Cell>
   </Row>
   <Row>
    <Cell ss:StyleID="s62"><Data ss:Type="DateTime">2022-04-18T00:00:00.000</Data></Cell>
    <Cell><Data ss:Type="String">SCTASK0122469</Data></Cell>
    <Cell><Data ss:Type="String">Snejana Farberov </Data></Cell>
    <Cell><Data ss:Type="String"> sfarberov@nypost.com </Data></Cell>
    <Cell><Data ss:Type="String"> PC</Data></Cell>
    <Cell ss:Index="7"><Data ss:Type="String">Snejana Farberov's first day is 4/18/22. Please activate all nypost accounts and model after Lia Eustachewich.  Dell Latitude 5420. For softwares, Microsoft office, methode, Global Protect.</Data></Cell>
   </Row>
   <Row>
    <Cell ss:StyleID="s62"><Data ss:Type="DateTime">2022-04-18T00:00:00.000</Data></Cell>
    <Cell><Data ss:Type="String">N/A</Data></Cell>
    <Cell><Data ss:Type="String">Jordyn Tilchen </Data></Cell>
    <Cell><Data ss:Type="String"> jtilchen@nypost.com </Data></Cell>
    <Cell><Data ss:Type="String"> Mac</Data></Cell>
    <Cell ss:Index="7"><Data ss:Type="String">Jordyn Tilchen's first day is 4/18/22. Please activate all nypost accounts and model after Zac Croce. She'll need Macbook Pro 13&quot;.  For softwares, Parsely, Airtable, WordPress, Google Search Console, Google Analytics, Microsoft Office, Global Protect.</Data></Cell>
   </Row>
   <Row>
    <Cell ss:StyleID="s62"><Data ss:Type="DateTime">2022-04-18T00:00:00.000</Data></Cell>
    <Cell><Data ss:Type="String">N/A</Data></Cell>
    <Cell><Data ss:Type="String">Zach Williams </Data></Cell>
    <Cell><Data ss:Type="String"> zwilliams@nypost.com</Data></Cell>
    <Cell ss:Index="7"><Data ss:Type="String">Zach William's first day is 4/18/22. Please activate all nypost accounts and model after Bernadette Hogan.  Macbook Pro 13&quot;. For softwares, airtable, slack, Global Protect.</Data></Cell>
   </Row>
   <Row>
    <Cell ss:StyleID="s62"><Data ss:Type="DateTime">2022-04-25T00:00:00.000</Data></Cell>
    <Cell><Data ss:Type="String">SCTASK0126554</Data></Cell>
    <Cell><Data ss:Type="String">Greta Bjornson </Data></Cell>
    <Cell><Data ss:Type="String"> gbjornson@decider.com </Data></Cell>
    <Cell><Data ss:Type="String"> Mac</Data></Cell>
    <Cell ss:Index="7"><Data ss:Type="String">Greta Bjornson is being rehired on 4/25/2022. She'll need Macbook Pro 13&quot;. For software, she'll need Photoshop, Office, Slack, Global Protect. (email sent out: 04-25-2022)</Data></Cell>
   </Row>
   <Row>
    <Cell ss:StyleID="s62"><Data ss:Type="DateTime">2022-05-04T00:00:00.000</Data></Cell>
    <Cell><Data ss:Type="String">SCTASK0134813</Data></Cell>
    <Cell><Data ss:Type="String">Jessica Cherner </Data></Cell>
    <Cell><Data ss:Type="String"> jcherner@nypost.com </Data></Cell>
    <Cell><Data ss:Type="String"> PC</Data></Cell>
    <Cell ss:Index="7"><Data ss:Type="String">Jessica Cherner's first day is 5/4/2022. Please activate all nypost accounts and model after Dana Kennedy.  For softwares, she'll need Methode, Merlin, AirTable, Wordpress, Slack, Microsoft Word. (Need To Sent Out Email - 05-04-2022).</Data></Cell>
   </Row>
   <Row>
    <Cell ss:StyleID="s62"><Data ss:Type="DateTime">2022-05-09T00:00:00.000</Data></Cell>
    <Cell><Data ss:Type="String">SCTASK0134875</Data></Cell>
    <Cell><Data ss:Type="String">Riley Cardoza </Data></Cell>
    <Cell><Data ss:Type="String"> rcardoza@nypost.com </Data></Cell>
    <Cell><Data ss:Type="String"> Mac</Data></Cell>
    <Cell ss:StyleID="s62"><Data ss:Type="DateTime">2022-05-09T00:00:00.000</Data></Cell>
    <Cell><Data ss:Type="String">.Riley Cardoza's first day is 5/9/2022. Please activate all nypost accounts and model after Nick Hautman. For softwares, slack, photoshop, MS word, airtable, and global protect. (05-09-2022)</Data></Cell>
   </Row>
   <Row>
    <Cell ss:StyleID="s62"><Data ss:Type="DateTime">2022-05-09T00:00:00.000</Data></Cell>
    <Cell><Data ss:Type="String">SCTASK0134813/SCTASK0134905</Data></Cell>
    <Cell><Data ss:Type="String">Edward Glazarev </Data></Cell>
    <Cell><Data ss:Type="String"> eglazarev@nypost.com </Data></Cell>
    <Cell><Data ss:Type="String"> PC</Data></Cell>
    <Cell ss:StyleID="s62"><Data ss:Type="DateTime">2022-05-09T00:00:00.000</Data></Cell>
    <Cell><Data ss:Type="String">Edward Glazarev's first day is 5/9/2022. Please activate all nypost accounts and model after Bradley Davis. For softwares, he'll need Methode, Merlin, Photoshop on Dell laptop. (05-09-2022).</Data></Cell>
   </Row>
   <Row>
    <Cell ss:StyleID="s62"><Data ss:Type="DateTime">2022-05-09T00:00:00.000</Data></Cell>
    <Cell><Data ss:Type="String">N/A</Data></Cell>
    <Cell><Data ss:Type="String">Jatin Gongiwala </Data></Cell>
    <Cell><Data ss:Type="String"> jgongiwala@nypost.com </Data></Cell>
    <Cell><Data ss:Type="String"> Mac</Data></Cell>
    <Cell ss:Index="7"><Data ss:Type="String">Jatin Gongiwala's first day is 5/9/2022. Please activate all nypost accounts and model after Samantha Previte. For softwares, microsoft excel. </Data></Cell>
   </Row>
   <Row>
    <Cell ss:StyleID="s62"><Data ss:Type="DateTime">2022-04-30T00:00:00.000</Data></Cell>
    <Cell><Data ss:Type="String">SCTASK0130274</Data></Cell>
    <Cell><Data ss:Type="String">Meenakshi Krishnan </Data></Cell>
    <Cell><Data ss:Type="String"> mkrishnan.consultant@nypost.com</Data></Cell>
    <Cell ss:Index="6" ss:StyleID="s62"><Data ss:Type="DateTime">2022-05-02T00:00:00.000</Data></Cell>
    <Cell><Data ss:Type="String">DWT has&#160;a&#160;new attorney,&#160;Ms. Meenakshi Krishnan, who will be assisting with prepub work and will need remote access. (Email sent 05-02-2022)</Data></Cell>
   </Row>
   <Row>
    <Cell ss:StyleID="s62"><Data ss:Type="DateTime">2022-05-09T00:00:00.000</Data></Cell>
    <Cell><Data ss:Type="String">SCTASK0134813</Data></Cell>
    <Cell><Data ss:Type="String">Allison (Allie) Griffin </Data></Cell>
    <Cell><Data ss:Type="String"> agriffin@nypost.com </Data></Cell>
    <Cell><Data ss:Type="String">PC</Data></Cell>
    <Cell ss:StyleID="s62"><Data ss:Type="DateTime">2022-05-09T00:00:00.000</Data></Cell>
    <Cell><Data ss:Type="String">Allison Griffin's first day is 5/9/2022. Please activate all nypost accounts and model after Lia Eustachewich. Dell Latitude 5420. For softwares, methode/microsoft office/global protect. (05-09-2022)</Data></Cell>
   </Row>
   <Row>
    <Cell ss:StyleID="s62"><Data ss:Type="DateTime">2022-05-09T00:00:00.000</Data></Cell>
    <Cell><Data ss:Type="String">SCTASK0134813</Data></Cell>
    <Cell><Data ss:Type="String">David Propper </Data></Cell>
    <Cell><Data ss:Type="String"> dpropper@nypost.com </Data></Cell>
    <Cell><Data ss:Type="String"> PC</Data></Cell>
    <Cell ss:StyleID="s62"><Data ss:Type="DateTime">2022-05-09T00:00:00.000</Data></Cell>
    <Cell><Data ss:Type="String">David Propper's first day is 5/9/2022. Please activate all nypost accounts and model after Lia Eustachewich/Snejana Farberov. For softwares, methode/microsoft office/global protect. - (05-09-2022).</Data></Cell>
   </Row>
   <Row>
    <Cell ss:StyleID="s62"><Data ss:Type="DateTime">2022-05-16T00:00:00.000</Data></Cell>
    <Cell><Data ss:Type="String">N/A</Data></Cell>
    <Cell><Data ss:Type="String">Christopher (Brendan) O'Connell </Data></Cell>
    <Cell><Data ss:Type="String"> boconnell@nypost.com </Data></Cell>
    <Cell><Data ss:Type="String"> Mac</Data></Cell>
    <Cell ss:Index="7"><Data ss:Type="String">For softwares, Microsoft Office, Google Search Console (Owner, all domains), Google Analytics, Parsely, WordPress, Global Protect.</Data></Cell>
   </Row>
   <Row>
    <Cell ss:StyleID="s62"><Data ss:Type="DateTime">2022-05-21T00:00:00.000</Data></Cell>
    <Cell><Data ss:Type="String">SCTASK0142708</Data></Cell>
    <Cell><Data ss:Type="String">Olivia Silio </Data></Cell>
    <Cell><Data ss:Type="String"> osilio@nypost.com </Data></Cell>
    <Cell><Data ss:Type="String"> Mac</Data></Cell>
    <Cell ss:StyleID="s62"><Data ss:Type="DateTime">2022-05-16T00:00:00.000</Data></Cell>
    <Cell><Data ss:Type="String">Olivia Silio's first day is 5/21/22. Her manager is Warren Cohen. Please activate all nypost accounts and model after Thomas Hogan as soon as possible.For softwares, adobe creative suite, slack, frame.io, global protect. (05-20-2022).</Data></Cell>
   </Row>
   <Row>
    <Cell ss:StyleID="s62"><Data ss:Type="DateTime">2022-05-23T00:00:00.000</Data></Cell>
    <Cell><Data ss:Type="String">SCTASK0143526</Data></Cell>
    <Cell><Data ss:Type="String">Barret Wertz </Data></Cell>
    <Cell><Data ss:Type="String"> bwertz@nypost.com </Data></Cell>
    <Cell><Data ss:Type="String"> Mac</Data></Cell>
    <Cell ss:StyleID="s62"><Data ss:Type="DateTime">2022-05-09T00:00:00.000</Data></Cell>
    <Cell><Data ss:Type="String">For softwares, he'll need Microsoft Office, Global Protect, and Adobe Photoshop. (Email  sent - 05-23-2022).</Data></Cell>
   </Row>
   <Row>
    <Cell ss:StyleID="s62"><Data ss:Type="DateTime">2022-05-31T00:00:00.000</Data></Cell>
    <Cell><Data ss:Type="String">N/A</Data></Cell>
    <Cell><Data ss:Type="String">Stephanie Burgess </Data></Cell>
    <Cell><Data ss:Type="String"> sburgess@nypost.com </Data></Cell>
    <Cell><Data ss:Type="String"> PC</Data></Cell>
    <Cell ss:Index="7"><Data ss:Type="String">Stephanie Burgess' first day is 5/31/22. Her manager is Kim Muir. Please activate all nypost accounts and model after Olga Leus. For softwares, Microsoft Office, Workday access, Global Protect.</Data></Cell>
   </Row>
   <Row>
    <Cell ss:StyleID="s62"><Data ss:Type="DateTime">2022-06-06T00:00:00.000</Data></Cell>
    <Cell><Data ss:Type="String">SCTASK0146790/SCTASK0143533</Data></Cell>
    <Cell><Data ss:Type="String">Emily Lefroy </Data></Cell>
    <Cell><Data ss:Type="String"> elefroy@nypost.com </Data></Cell>
    <Cell><Data ss:Type="String">  PC</Data></Cell>
    <Cell ss:StyleID="s62"><Data ss:Type="DateTime">2022-05-16T00:00:00.000</Data></Cell>
    <Cell><Data ss:Type="String">Emily Lefroy's first day is 6/6/22. Her manager is Hailey Eber. Please activate all nypost accounts and model after Asia Grace Gaskin. For softwares, Wordpress, Airtable, Merlin, Photoshop, global protect. (Sent Out Email - 06-06-2022).</Data></Cell>
   </Row>
   <Row>
    <Cell ss:StyleID="s62"><Data ss:Type="DateTime">2022-06-06T00:00:00.000</Data></Cell>
    <Cell><Data ss:Type="String">N/A</Data></Cell>
    <Cell><Data ss:Type="String">Ryan Murphy </Data></Cell>
    <Cell><Data ss:Type="String"> rmurphy@nypost.com </Data></Cell>
    <Cell><Data ss:Type="String">  Mac)</Data></Cell>
    <Cell ss:Index="7"><Data ss:Type="String">Ryan Murphy's first day is 6/6/22. His manager is Jackie Goldstein. Please activate all nypost accounts and model after Cade Burk. For softwares, Microsoft Office. </Data></Cell>
   </Row>
   <Row>
    <Cell ss:StyleID="s62"><Data ss:Type="DateTime">2022-05-24T00:00:00.000</Data></Cell>
    <Cell><Data ss:Type="String">SCTASK0144762</Data></Cell>
    <Cell><Data ss:Type="String">David Landsel </Data></Cell>
    <Cell><Data ss:Type="String"> dlandsel@nypost.com</Data></Cell>
    <Cell ss:Index="6" ss:StyleID="s62"><Data ss:Type="DateTime">2022-05-24T00:00:00.000</Data></Cell>
    <Cell><Data ss:Type="String">David Landsel's first day is 5/24/2022. His manager is Carla Spartos. Please reactivate all nypost accounts and model after Rachelle Bergstein.  For softwares, Methode, Merlin, Wordpress, Airtable, and Global Protect. (05-24-2022)</Data></Cell>
   </Row>
   <Row>
    <Cell ss:StyleID="s62"><Data ss:Type="DateTime">2022-05-31T00:00:00.000</Data></Cell>
    <Cell><Data ss:Type="String">SCTASK0148194</Data></Cell>
    <Cell><Data ss:Type="String">Elizabeth Karpen </Data></Cell>
    <Cell><Data ss:Type="String"> ekarpen@nypost.com </Data></Cell>
    <Cell><Data ss:Type="String"> Mac</Data></Cell>
    <Cell ss:StyleID="s62"><Data ss:Type="DateTime">2022-05-31T00:00:00.000</Data></Cell>
    <Cell><Data ss:Type="String">Elizabeth Karpen is converting over to full-time on 5/31. Her e-mail should now be: ekarpen@nypost.com. For software, she'll need Methode/Parallels/Citrix, Merlin, Adobe Photoshop, Microsoft Office, Slack. Please model after Taylor Knight. (Emails Sent - 05-31-2022)</Data></Cell>
   </Row>
   <Row>
    <Cell ss:StyleID="s62"><Data ss:Type="DateTime">2022-06-06T00:00:00.000</Data></Cell>
    <Cell><Data ss:Type="String">SCTASK0152002</Data></Cell>
    <Cell><Data ss:Type="String">Nicole Lee </Data></Cell>
    <Cell><Data ss:Type="String"> nlee.intern@nypost.com </Data></Cell>
    <Cell><Data ss:Type="String"> Mac</Data></Cell>
    <Cell ss:StyleID="s62"><Data ss:Type="DateTime">2022-06-07T00:00:00.000</Data></Cell>
    <Cell><Data ss:Type="String">frame.io, adobe creative suite, slack - (Email Sent Out - 06-07-2022).</Data></Cell>
   </Row>
   <Row>
    <Cell ss:StyleID="s62"><Data ss:Type="DateTime">2022-06-06T00:00:00.000</Data></Cell>
    <Cell><Data ss:Type="String">SCTASK0152608</Data></Cell>
    <Cell><Data ss:Type="String">Sekhena Sembenu </Data></Cell>
    <Cell><Data ss:Type="String"> ssembenu.intern@decider.com  </Data></Cell>
    <Cell><Data ss:Type="String"> Mac</Data></Cell>
    <Cell ss:StyleID="s62"><Data ss:Type="DateTime">2022-06-06T00:00:00.000</Data></Cell>
    <Cell><Data ss:Type="String">Summer Intern - starting 06-06-2022 - Manager Alex Zalben - Software - Adobe Photoshop - model after Greta Bjornson. Macbook Pro 13&quot; (06-06-2022)</Data></Cell>
   </Row>
   <Row>
    <Cell ss:StyleID="s62"><Data ss:Type="DateTime">2022-06-06T00:00:00.000</Data></Cell>
    <Cell><Data ss:Type="String">SCTASK0151967</Data></Cell>
    <Cell><Data ss:Type="String">Suzanne Haskell </Data></Cell>
    <Cell><Data ss:Type="String"> shaskell.intern@nypost.com</Data></Cell>
    <Cell ss:Index="6" ss:StyleID="s62"><Data ss:Type="DateTime">2022-06-06T00:00:00.000</Data></Cell>
    <Cell><Data ss:Type="String">Summer Intern - starting 06-06-2022 - Manager Angie Scire - Adobe Photoshop, Dropbox, Google Drive - (Email sent 06-06-2022)</Data></Cell>
   </Row>
   <Row>
    <Cell ss:StyleID="s62"><Data ss:Type="DateTime">2022-06-06T00:00:00.000</Data></Cell>
    <Cell><Data ss:Type="String">SCTASK0151223\SCTASK0152626</Data></Cell>
    <Cell><Data ss:Type="String">Jared Greenspan </Data></Cell>
    <Cell><Data ss:Type="String"> jgreenspan.intern@nypost.com </Data></Cell>
    <Cell><Data ss:Type="String"> PC</Data></Cell>
    <Cell ss:StyleID="s62"><Data ss:Type="DateTime">2022-06-06T00:00:00.000</Data></Cell>
    <Cell><Data ss:Type="String">Summer Intern - starting 06-06-2022 - Methode, WordPress, Merlin, Photoshop, Office - (Email Sent Out - 06-06-2022)</Data></Cell>
   </Row>
   <Row>
    <Cell ss:StyleID="s62"><Data ss:Type="DateTime">2022-06-06T00:00:00.000</Data></Cell>
    <Cell><Data ss:Type="String">SCTASK0151223\SCTASK0152633</Data></Cell>
    <Cell><Data ss:Type="String">David Scott </Data></Cell>
    <Cell><Data ss:Type="String"> dscott.intern@nypost.com </Data></Cell>
    <Cell><Data ss:Type="String"> PC</Data></Cell>
    <Cell ss:StyleID="s62"><Data ss:Type="DateTime">2022-06-06T00:00:00.000</Data></Cell>
    <Cell><Data ss:Type="String">Summer Intern - starting 06-06-2022 - Methode, WordPress, Merlin, Photoshop, Office - (Email Sent Out - 06-06-2022)</Data></Cell>
   </Row>
   <Row>
    <Cell ss:StyleID="s62"><Data ss:Type="DateTime">2022-06-06T00:00:00.000</Data></Cell>
    <Cell><Data ss:Type="String">SCTASK0151223\SCTASK0152638</Data></Cell>
    <Cell><Data ss:Type="String">Matthew Neschis (rehire) </Data></Cell>
    <Cell><Data ss:Type="String"> mneschis.intern@nypost.com </Data></Cell>
    <Cell><Data ss:Type="String"> PC</Data></Cell>
    <Cell ss:StyleID="s62"><Data ss:Type="DateTime">2022-06-06T00:00:00.000</Data></Cell>
    <Cell><Data ss:Type="String">Summer Intern - starting 06-06-2022 - Methode, WordPress, Merlin, Photoshop, Office - (Email Sent Out - 06-06-2022)</Data></Cell>
   </Row>
   <Row>
    <Cell ss:StyleID="s62"><Data ss:Type="DateTime">2022-06-06T00:00:00.000</Data></Cell>
    <Cell><Data ss:Type="String">SCTASK0151982</Data></Cell>
    <Cell><Data ss:Type="String">Shane Palma </Data></Cell>
    <Cell><Data ss:Type="String"> spalma.intern@nypost.com </Data></Cell>
    <Cell><Data ss:Type="String"> Mac</Data></Cell>
    <Cell ss:StyleID="s62"><Data ss:Type="DateTime">2022-06-06T00:00:00.000</Data></Cell>
    <Cell><Data ss:Type="String">Summer Intern - starting 06-06-2022 - Adobe Photoshop - (Email Sent Out - 06-06-2022)</Data></Cell>
   </Row>
   <Row>
    <Cell ss:StyleID="s62"><Data ss:Type="DateTime">2022-06-06T00:00:00.000</Data></Cell>
    <Cell><Data ss:Type="String">SCTASK0151223\SCTASK0152011</Data></Cell>
    <Cell><Data ss:Type="String">Julia Kahen </Data></Cell>
    <Cell><Data ss:Type="String"> jkahen.intern@nypost.com </Data></Cell>
    <Cell><Data ss:Type="String"> Mac</Data></Cell>
    <Cell ss:StyleID="s62"><Data ss:Type="DateTime">2022-06-06T00:00:00.000</Data></Cell>
    <Cell><Data ss:Type="String">Summer Intern - starting 06-06-2022 - Merlin, Adobe Photoshop, Slack - (Email Sent Out - 06-06-2022)</Data></Cell>
   </Row>
   <Row>
    <Cell ss:StyleID="s62"><Data ss:Type="DateTime">2022-06-06T00:00:00.000</Data></Cell>
    <Cell><Data ss:Type="String">SCTASK0151223\SCTASK0152020</Data></Cell>
    <Cell><Data ss:Type="String">Isabel Bekele </Data></Cell>
    <Cell><Data ss:Type="String"> ibekele.intern@nypost.com </Data></Cell>
    <Cell><Data ss:Type="String"> Mac</Data></Cell>
    <Cell ss:StyleID="s62"><Data ss:Type="DateTime">2022-06-06T00:00:00.000</Data></Cell>
    <Cell><Data ss:Type="String">Summer Intern - starting 06-06-2022 - Merlin, Adobe Photoshop, Slack - (Email Sent Out - 06-06-2022)</Data></Cell>
   </Row>
   <Row>
    <Cell ss:StyleID="s62"><Data ss:Type="DateTime">2022-06-06T00:00:00.000</Data></Cell>
    <Cell><Data ss:Type="String">SCTASK0152651</Data></Cell>
    <Cell><Data ss:Type="String">Jolie Zenna </Data></Cell>
    <Cell><Data ss:Type="String"> jzenna.intern@nypost.com </Data></Cell>
    <Cell><Data ss:Type="String"> Mac</Data></Cell>
    <Cell ss:StyleID="s62"><Data ss:Type="DateTime">2022-06-06T00:00:00.000</Data></Cell>
    <Cell><Data ss:Type="String">Summer Intern - starting 06-06-2022 - Microsoft Office, Photoshop - (Email Sent Out - 06-06-2022)</Data></Cell>
   </Row>
   <Row>
    <Cell ss:StyleID="s62"><Data ss:Type="DateTime">2022-06-06T00:00:00.000</Data></Cell>
    <Cell><Data ss:Type="String">SCTASK0151223</Data></Cell>
    <Cell><Data ss:Type="String">Maddie Panzer </Data></Cell>
    <Cell><Data ss:Type="String"> mpanzer.intern@nypost.com</Data></Cell>
    <Cell ss:Index="6" ss:StyleID="s62"><Data ss:Type="DateTime">2022-06-06T00:00:00.000</Data></Cell>
    <Cell><Data ss:Type="String">Summer Intern - starting 06-06-2022 - Methode, Worpress, Airtable - (Email Sent Out - 06-06-2022)</Data></Cell>
   </Row>
   <Row>
    <Cell ss:StyleID="s62"><Data ss:Type="DateTime">2022-06-06T00:00:00.000</Data></Cell>
    <Cell><Data ss:Type="String">SCTASK0151223</Data></Cell>
    <Cell><Data ss:Type="String">Irie Sentner </Data></Cell>
    <Cell><Data ss:Type="String"> isentner.intern@nypost.com</Data></Cell>
    <Cell ss:Index="6" ss:StyleID="s62"><Data ss:Type="DateTime">2022-06-06T00:00:00.000</Data></Cell>
    <Cell><Data ss:Type="String">Summer Intern - starting 06-06-2022 - Methode, Worpress, Airtable - (Email Sent Out - 06-06-2022)</Data></Cell>
   </Row>
   <Row>
    <Cell ss:StyleID="s62"><Data ss:Type="DateTime">2022-06-06T00:00:00.000</Data></Cell>
    <Cell><Data ss:Type="String">SCTASK0151223\SCTASK0152039</Data></Cell>
    <Cell><Data ss:Type="String">Caroline Coyer </Data></Cell>
    <Cell><Data ss:Type="String"> ccoyer.intern@nypost.com </Data></Cell>
    <Cell><Data ss:Type="String"> Mac</Data></Cell>
    <Cell ss:StyleID="s62"><Data ss:Type="DateTime">2022-06-06T00:00:00.000</Data></Cell>
    <Cell><Data ss:Type="String">Summer Intern - starting 06-06-2022 - Office, Merlin, Photoshop, Premiere - (Email Sent Out - 06-06-2022)</Data></Cell>
   </Row>
   <Row>
    <Cell ss:StyleID="s62"><Data ss:Type="DateTime">2022-06-06T00:00:00.000</Data></Cell>
    <Cell><Data ss:Type="String">SCTASK0152022</Data></Cell>
    <Cell><Data ss:Type="String">Emma Cavoli </Data></Cell>
    <Cell><Data ss:Type="String"> ecavoli.intern@nypost.com Mac</Data></Cell>
    <Cell ss:Index="6" ss:StyleID="s62"><Data ss:Type="DateTime">2022-06-06T00:00:00.000</Data></Cell>
    <Cell><Data ss:Type="String">Summer Intern - starting 06-06-2022 - Adobe Photoshop - (Email Sent Out - 06-06-2022)</Data></Cell>
   </Row>
   <Row>
    <Cell ss:StyleID="s62"><Data ss:Type="DateTime">2022-06-06T00:00:00.000</Data></Cell>
    <Cell><Data ss:Type="String">SCTASK0151223</Data></Cell>
    <Cell><Data ss:Type="String">Desheania Andrews </Data></Cell>
    <Cell><Data ss:Type="String"> dandrews.intern@nypost.com </Data></Cell>
    <Cell><Data ss:Type="String"> PC</Data></Cell>
    <Cell ss:StyleID="s62"><Data ss:Type="DateTime">2022-06-06T00:00:00.000</Data></Cell>
    <Cell><Data ss:Type="String">Summer Intern - starting 06-06-2022 - Methode, Microsoft Office - (Email Sent Out - 06-06-2022)</Data></Cell>
   </Row>
   <Row>
    <Cell ss:StyleID="s62"><Data ss:Type="DateTime">2022-06-06T00:00:00.000</Data></Cell>
    <Cell><Data ss:Type="String">SCTASK0151223</Data></Cell>
    <Cell><Data ss:Type="String">Valentina Jaramillo </Data></Cell>
    <Cell><Data ss:Type="String"> vjaramillo.intern@nypost.com </Data></Cell>
    <Cell><Data ss:Type="String"> PC</Data></Cell>
    <Cell ss:StyleID="s62"><Data ss:Type="DateTime">2022-06-06T00:00:00.000</Data></Cell>
    <Cell><Data ss:Type="String">Summer Intern - starting 06-06-2022 - Methode, Microsoft Office - (Email Sent Out - 06-06-2022)</Data></Cell>
   </Row>
   <Row>
    <Cell ss:StyleID="s62"><Data ss:Type="DateTime">2022-06-06T00:00:00.000</Data></Cell>
    <Cell><Data ss:Type="String">SCTASK0151223</Data></Cell>
    <Cell><Data ss:Type="String">M'Niyah Lynn </Data></Cell>
    <Cell><Data ss:Type="String"> mlynn.intern@nypost.com </Data></Cell>
    <Cell><Data ss:Type="String"> PC</Data></Cell>
    <Cell ss:StyleID="s62"><Data ss:Type="DateTime">2022-06-06T00:00:00.000</Data></Cell>
    <Cell><Data ss:Type="String">Summer Intern - starting 06-06-2022 - Methode, Microsoft Office - (Email Sent Out - 06-06-2022)</Data></Cell>
   </Row>
   <Row>
    <Cell ss:StyleID="s62"><Data ss:Type="DateTime">2022-06-06T00:00:00.000</Data></Cell>
    <Cell><Data ss:Type="String">SCTASK0152032</Data></Cell>
    <Cell><Data ss:Type="String">Hannah Schinzing </Data></Cell>
    <Cell><Data ss:Type="String"> hschinzing@nypost.com </Data></Cell>
    <Cell><Data ss:Type="String"> Mac</Data></Cell>
    <Cell ss:StyleID="s62"><Data ss:Type="DateTime">2022-06-06T00:00:00.000</Data></Cell>
    <Cell><Data ss:Type="String">Summer Intern - starting 06-06-2022 - ADOBE PHOTOSHOP, ADOBE PREMIERE, ADOBE ACROBAT, GIFBREWERY - (Email Sent Out - 06-06-2022)</Data></Cell>
   </Row>
   <Row>
    <Cell ss:StyleID="s62"><Data ss:Type="DateTime">2022-06-06T00:00:00.000</Data></Cell>
    <Cell><Data ss:Type="String">SCTASK0152035</Data></Cell>
    <Cell><Data ss:Type="String">Thomas Cohen </Data></Cell>
    <Cell><Data ss:Type="String"> tcohen.intern@nypost.com </Data></Cell>
    <Cell><Data ss:Type="String"> Mac</Data></Cell>
    <Cell ss:StyleID="s62"><Data ss:Type="DateTime">2022-06-06T00:00:00.000</Data></Cell>
    <Cell><Data ss:Type="String">Summer Intern - starting 06-06-2022 - Adobe Photoshop, Adobe Premiere - (Email Sent Out - 06-06-2022)</Data></Cell>
   </Row>
   <Row>
    <Cell ss:StyleID="s62"><Data ss:Type="DateTime">2022-06-03T00:00:00.000</Data></Cell>
    <Cell><Data ss:Type="String">SCTASK0151223</Data></Cell>
    <Cell><Data ss:Type="String">Bob Fredericks </Data></Cell>
    <Cell><Data ss:Type="String"> RFredericks@nypost.com </Data></Cell>
    <Cell><Data ss:Type="String"> PC</Data></Cell>
    <Cell ss:StyleID="s62"><Data ss:Type="DateTime">2022-06-06T00:00:00.000</Data></Cell>
    <Cell><Data ss:Type="String">Bob Fredericks' first day is 6/3/2022. His manager is Gary Buiso. Please activate all nypost accounts and model after Gary Buiso. For softwares, nypost email, methode, wordpress, airtable, browser, google, office, global protect. (Email Sent Out - 06-06-2022)</Data></Cell>
   </Row>
   <Row>
    <Cell ss:StyleID="s62"><Data ss:Type="DateTime">2022-06-06T00:00:00.000</Data></Cell>
    <Cell><Data ss:Type="String">SCTASK0152662</Data></Cell>
    <Cell><Data ss:Type="String">Sophia Caraballo </Data></Cell>
    <Cell><Data ss:Type="String"> scaraballo@nypost.com Mac</Data></Cell>
    <Cell ss:Index="6" ss:StyleID="s62"><Data ss:Type="DateTime">2022-06-06T00:00:00.000</Data></Cell>
    <Cell><Data ss:Type="String">Sophia Caraballo's first day is 6/6/22. Her manager is Ally D'Aluisio. Please activate all nypost accounts and model after Riley Cardoza.&#160;For softwares, slack, airtable, MS office, photoshop, global protect. (06-06-2022)</Data></Cell>
   </Row>
   <Row>
    <Cell ss:StyleID="s62"><Data ss:Type="DateTime">2022-06-06T00:00:00.000</Data></Cell>
    <Cell><Data ss:Type="String">SCTASK0152042</Data></Cell>
    <Cell><Data ss:Type="String">Akanke Jackson </Data></Cell>
    <Cell><Data ss:Type="String"> ajackson@decider.com Mac</Data></Cell>
    <Cell ss:Index="6" ss:StyleID="s62"><Data ss:Type="DateTime">2022-06-06T00:00:00.000</Data></Cell>
    <Cell><Data ss:Type="String">Akanke Jackson's first day is 6/6/2022. Her manager is Alex Zalben. Please activate all nypost accounts and model after Greta Bjornson. For softwares, she'll need Microsoft Office, Slack, Photoshop. (Email sent out - 06-06-2022)</Data></Cell>
   </Row>
   <Row>
    <Cell ss:StyleID="s62"><Data ss:Type="DateTime">2022-06-13T00:00:00.000</Data></Cell>
    <Cell><Data ss:Type="String">SCTASK0155261</Data></Cell>
    <Cell><Data ss:Type="String">Cindy Martinez </Data></Cell>
    <Cell><Data ss:Type="String"> cmartinez@nypost.com </Data></Cell>
    <Cell><Data ss:Type="String"> PC</Data></Cell>
    <Cell ss:StyleID="s62"><Data ss:Type="DateTime">2022-06-13T00:00:00.000</Data></Cell>
    <Cell><Data ss:Type="String">Cindy Martinez's first day is 6/13/22. Her manager is Karen Cifone. Please activate all nypost accounts and model after Desmond Nieves. For softwares, she'll need Microsoft office, Adobe Acrobat Pro, and from Citrix she needs DTI, Adbase and Diver. (Email sent out - 06-13-2022.)</Data></Cell>
   </Row>
   <Row>
    <Cell ss:StyleID="s62"><Data ss:Type="DateTime">2022-06-13T00:00:00.000</Data></Cell>
    <Cell><Data ss:Type="String">SCTASK0155257</Data></Cell>
    <Cell><Data ss:Type="String">Victoria Matthews </Data></Cell>
    <Cell><Data ss:Type="String"> vmatthews@nypost.com </Data></Cell>
    <Cell><Data ss:Type="String"> Mac</Data></Cell>
    <Cell ss:StyleID="s62"><Data ss:Type="DateTime">2022-06-13T00:00:00.000</Data></Cell>
    <Cell><Data ss:Type="String">Victoria Matthews' first day is 6/13/22. Her manager is Melissa Smith. Please activate all nypost accounts and model after Taylor Valentine.  For softwares,  adobe creative suite, dropbox, slack, frame.io. - ((Email sent out - 06-13-2022).</Data></Cell>
   </Row>
   <Row>
    <Cell ss:StyleID="s62"><Data ss:Type="DateTime">2022-06-21T00:00:00.000</Data></Cell>
    <Cell><Data ss:Type="String">SCTASK0160304</Data></Cell>
    <Cell><Data ss:Type="String">Nicole Gallucci </Data></Cell>
    <Cell><Data ss:Type="String"> ngallucci@decider.com Mac </Data></Cell>
    <Cell ss:Index="7"><Data ss:Type="String">Nicole Gallucci's first day is on 6/21/22. Her manager is Mark Graham. For softwares, she'll need ADOBE PHOTOSHOP, GIF BREWERY, SLACK, ADOBE ACROBAT, SKYPE. (Email sent 06-21-2022)</Data></Cell>
   </Row>
   <Row>
    <Cell ss:StyleID="s62"><Data ss:Type="DateTime">2022-07-05T00:00:00.000</Data></Cell>
    <Cell><Data ss:Type="String">SCTASK0155957</Data></Cell>
    <Cell><Data ss:Type="String">Julia Remillard </Data></Cell>
    <Cell><Data ss:Type="String"> jremillard@nypost.com </Data></Cell>
    <Cell><Data ss:Type="String"> Mac</Data></Cell>
    <Cell ss:Index="7"><Data ss:Type="String">Julia Remillard's first day is 7/5/2022. She'll be reporting to Kristin McNamara. Please activate all nypost accounts and model after Kristin McNamara.</Data></Cell>
   </Row>
   <Row>
    <Cell ss:StyleID="s62"><Data ss:Type="DateTime">2022-07-05T00:00:00.000</Data></Cell>
    <Cell><Data ss:Type="String">SCTASK0166549\SCTASK0167135</Data></Cell>
    <Cell><Data ss:Type="String">Jeff Colson </Data></Cell>
    <Cell><Data ss:Type="String"> JColson@nypost.com </Data></Cell>
    <Cell><Data ss:Type="String"> Mac</Data></Cell>
    <Cell ss:StyleID="s62"><Data ss:Type="DateTime">2022-07-01T00:00:00.000</Data></Cell>
    <Cell><Data ss:Type="String">Jeff Colson's first day is 7/5/22. His manager is Bryan Erickson. Please activate all nypost accounts and model after Toni Misthos. For softwares, he'll need Adobe CC (Photoshop, Indesign, Illustrator, Acrobat, Bridge), Methode, Merlin, Parallels, Wordpress login, AirTable login, Slack. (07-01-2022)</Data></Cell>
   </Row>
   <Row>
    <Cell ss:StyleID="s62"><Data ss:Type="DateTime">2022-06-21T00:00:00.000</Data></Cell>
    <Cell><Data ss:Type="String">N/A</Data></Cell>
    <Cell><Data ss:Type="String">Molly Palma </Data></Cell>
    <Cell><Data ss:Type="String"> mpalma.intern@nypost.com</Data></Cell>
    <Cell ss:Index="7"><Data ss:Type="String">Molly Palma's first day is 6/21/22. Please activate all nypost accounts and model after Kristen Yanez. Her primary email should be mpalma.intern@nypost.com.</Data></Cell>
   </Row>
   <Row>
    <Cell ss:StyleID="s62"><Data ss:Type="DateTime">2022-06-21T00:00:00.000</Data></Cell>
    <Cell><Data ss:Type="String">N/A</Data></Cell>
    <Cell><Data ss:Type="String">Stinson Fuller </Data></Cell>
    <Cell><Data ss:Type="String"> sfuller@nypost.com</Data></Cell>
    <Cell ss:Index="7"><Data ss:Type="String">Stinson Fuller's first day of work is 06/21/2022. His hiring manager is Jackie Jaramillo.</Data></Cell>
   </Row>
   <Row>
    <Cell ss:StyleID="s62"><Data ss:Type="DateTime">2022-06-21T00:00:00.000</Data></Cell>
    <Cell><Data ss:Type="String">SCTASK0160326\SCTASK0160328\SCTASK0160331</Data></Cell>
    <Cell><Data ss:Type="String">Daniel Shapiro </Data></Cell>
    <Cell><Data ss:Type="String"> dshapiro@nypost.com </Data></Cell>
    <Cell><Data ss:Type="String"> Mac</Data></Cell>
    <Cell ss:Index="7"><Data ss:Type="String">Daniel Shapiro's first day of work is 06/21/2022, his manager is  Chris Dougherty. Please activate all NY post accounts and model after Juan Arellano. Needed software's: Methode, Merlin, Adobe Photoshop. (06-21-2022)</Data></Cell>
   </Row>
   <Row>
    <Cell ss:StyleID="s62"><Data ss:Type="DateTime">2022-06-25T00:00:00.000</Data></Cell>
    <Cell><Data ss:Type="String">SCTASK0161769\SCTASK0161774</Data></Cell>
    <Cell><Data ss:Type="String">Sammy Erinc </Data></Cell>
    <Cell><Data ss:Type="String"> serinc@nypost.com </Data></Cell>
    <Cell><Data ss:Type="String"> PC</Data></Cell>
    <Cell ss:Index="7"><Data ss:Type="String">Sammy Erinc's first day is 06/25/2022. His manager is Derek O'Callaghan please model after him. Software's needed: Methode, merlin, photoshop, acrobat, illustrator, microsoft office, FTP client, methode barcode color and folio plugins.</Data></Cell>
   </Row>
   <Row>
    <Cell ss:StyleID="s62"><Data ss:Type="DateTime">2022-06-27T00:00:00.000</Data></Cell>
    <Cell><Data ss:Type="String">SCTASK0163437\SCTASK0163332</Data></Cell>
    <Cell><Data ss:Type="String">Richard Pollina </Data></Cell>
    <Cell><Data ss:Type="String"> rpollina@nypost.com </Data></Cell>
    <Cell><Data ss:Type="String"> Mac</Data></Cell>
    <Cell ss:StyleID="s62"><Data ss:Type="DateTime">2022-06-27T00:00:00.000</Data></Cell>
    <Cell><Data ss:Type="String">Richard Pollina's start date is 6/27/22. His manager is Eileen Holliday. Please activate all nypost accounts and model after Alec Gearty. Software needed: Adobe Photoshop, Merlin. (Emails sent - 06-27-2022).</Data></Cell>
   </Row>
   <Row>
    <Cell ss:StyleID="s62"><Data ss:Type="DateTime">2022-07-05T00:00:00.000</Data></Cell>
    <Cell><Data ss:Type="String">SCTASK0167132</Data></Cell>
    <Cell><Data ss:Type="String">Sierra Porter </Data></Cell>
    <Cell><Data ss:Type="String"> sporter.intern@nypost.com</Data></Cell>
    <Cell ss:Index="6" ss:StyleID="s62"><Data ss:Type="DateTime">2022-07-01T00:00:00.000</Data></Cell>
    <Cell><Data ss:Type="String">Sierra Porter's first day is 7/5/2022. Please activate all nypost accounts and model after Jolie Zenna. Her primary email should be sporter.intern@nypost.com.  For softwares, Photoshop, Microsoft office. - (Email sent out - 07-01-2022)</Data></Cell>
   </Row>
   <Row>
    <Cell ss:StyleID="s62"><Data ss:Type="DateTime">2022-07-05T00:00:00.000</Data></Cell>
    <Cell><Data ss:Type="String">SCTASK0167131</Data></Cell>
    <Cell><Data ss:Type="String">Nicki Cox </Data></Cell>
    <Cell><Data ss:Type="String"> ncox@nypost.com Mac</Data></Cell>
    <Cell ss:Index="6" ss:StyleID="s62"><Data ss:Type="DateTime">2022-07-01T00:00:00.000</Data></Cell>
    <Cell><Data ss:Type="String">Nicki Cox is converting to full-time on 7/5. For softwares, Photoshop, MS Office, slack, airtable. Her accounts should model Caroline Blair. - (Email sent out - 07-01-2022)</Data></Cell>
   </Row>
   <Row>
    <Cell ss:StyleID="s62"><Data ss:Type="DateTime">2022-06-27T00:00:00.000</Data></Cell>
    <Cell><Data ss:Type="String">SCTASK0166549</Data></Cell>
    <Cell><Data ss:Type="String">Kyle Schnitzer </Data></Cell>
    <Cell><Data ss:Type="String"> kschnitzer@nypost.com </Data></Cell>
    <Cell><Data ss:Type="String"> PC</Data></Cell>
    <Cell ss:Index="7"><Data ss:Type="String">Kyle Schnitzer's first day is 6/27/22. Please reactivate all nypost accounts and model after David Propper. For softwares, Methode, Microsoft office.</Data></Cell>
   </Row>
   <Row>
    <Cell ss:StyleID="s62"><Data ss:Type="DateTime">2022-07-11T00:00:00.000</Data></Cell>
    <Cell><Data ss:Type="String">SCTASK0172121</Data></Cell>
    <Cell><Data ss:Type="String">Darby Hyde </Data></Cell>
    <Cell><Data ss:Type="String"> dhyde@nypost.com </Data></Cell>
    <Cell><Data ss:Type="String"> PC</Data></Cell>
    <Cell ss:Index="7"><Data ss:Type="String">Darby Hyde's first day is 7/11/22. Her manager is Kelly Gordon. Please activate all nypost accounts and model after Rachel Small.  For softwares, Methode, Airtable, Wordpress, Slack, Google/gmail, OKTA. (07-11-2022)</Data></Cell>
   </Row>
   <Row>
    <Cell ss:StyleID="s62"><Data ss:Type="DateTime">2022-07-14T00:00:00.000</Data></Cell>
    <Cell><Data ss:Type="String">SCTASK0172078</Data></Cell>
    <Cell><Data ss:Type="String">Richard Pollina </Data></Cell>
    <Cell><Data ss:Type="String"> rpollina@nypost.com </Data></Cell>
    <Cell><Data ss:Type="String"> Mac</Data></Cell>
    <Cell ss:Index="7"><Data ss:Type="String">Richard Pollina is switching from part time to full time. His transition date is 7/14/2022. Please activate all NY Post accounts and model after Alec Gearty. Softwares needed: Adobe photoshop, Merlin. (07-12-2022).</Data></Cell>
   </Row>
   <Row>
    <Cell ss:StyleID="s62"><Data ss:Type="DateTime">2022-07-18T00:00:00.000</Data></Cell>
    <Cell><Data ss:Type="String">SCTASK0175180\SCTASK0172391</Data></Cell>
    <Cell><Data ss:Type="String">Jacquelyn Kozak </Data></Cell>
    <Cell><Data ss:Type="String"> jkozak@nypost.com </Data></Cell>
    <Cell><Data ss:Type="String"> Mac</Data></Cell>
    <Cell ss:StyleID="s62"><Data ss:Type="DateTime">2022-07-18T00:00:00.000</Data></Cell>
    <Cell><Data ss:Type="String"> Jacquelyn Kozak's first day of work is 7/18/2022.\Please activate all NY post accounts and model after Tori Schneebaum.\Softwares needed: Merlin, photoshop - (07-18-2022)</Data></Cell>
   </Row>
   <Row>
    <Cell ss:StyleID="s62"><Data ss:Type="DateTime">2022-07-18T00:00:00.000</Data></Cell>
    <Cell><Data ss:Type="String">SCTASK0176025</Data></Cell>
    <Cell><Data ss:Type="String">Samantha Nungesser </Data></Cell>
    <Cell><Data ss:Type="String"> snungesser@decider.com </Data></Cell>
    <Cell><Data ss:Type="String"> Mac</Data></Cell>
    <Cell ss:StyleID="s62"><Data ss:Type="DateTime">2022-07-19T00:00:00.000</Data></Cell>
    <Cell><Data ss:Type="String">Please activate all NY Post accounts and model accounts after Greta Bjornson. Software needed: ADOBE PHOTOSHOP, ADOBE ACROBAT, SLACK, GIFBREWERY. ( 07-19-2022)</Data></Cell>
   </Row>
   <Row>
    <Cell ss:StyleID="s62"><Data ss:Type="DateTime">2022-07-25T00:00:00.000</Data></Cell>
    <Cell><Data ss:Type="String">SCTASK0177772\SCTASK0177792</Data></Cell>
    <Cell><Data ss:Type="String">Gary Hershon </Data></Cell>
    <Cell><Data ss:Type="String"> ghershorn@nypost.com </Data></Cell>
    <Cell><Data ss:Type="String"> Mac</Data></Cell>
    <Cell ss:StyleID="s62"><Data ss:Type="DateTime">2022-07-21T00:00:00.000</Data></Cell>
    <Cell><Data ss:Type="String">Gary Hershon's first day is 07/25/2022. His manager is Chris Dougherty. Please activate all NY Post accounts and model after Annie Wermiel. Equipment needed: MacBook Air 13. Software's needed: Merlin, Methode, Photoshop. (07-22-2022)</Data></Cell>
   </Row>
   <Row>
    <Cell ss:StyleID="s62"><Data ss:Type="DateTime">2022-08-01T00:00:00.000</Data></Cell>
    <Cell><Data ss:Type="String">SCTASK0177797</Data></Cell>
    <Cell><Data ss:Type="String">Kelly Laske </Data></Cell>
    <Cell><Data ss:Type="String"> klaske@nypost.com </Data></Cell>
    <Cell><Data ss:Type="String"> Mac</Data></Cell>
    <Cell ss:StyleID="s62"><Data ss:Type="DateTime">2022-07-21T00:00:00.000</Data></Cell>
    <Cell><Data ss:Type="String">Kelly Laske's first day is 08/01/2022. Please activate all New York Post accounts and model after Lauren Higgins. Equipment needed: Macbook Air. Software needed: Adobe Photoshop - (Email sent 07-22-2022)</Data></Cell>
   </Row>
   <Row>
    <Cell ss:StyleID="s62"><Data ss:Type="DateTime">2022-07-25T00:00:00.000</Data></Cell>
    <Cell><Data ss:Type="String">N/A</Data></Cell>
    <Cell><Data ss:Type="String">Aman Vinayak </Data></Cell>
    <Cell><Data ss:Type="String"> avinayak@nypost.com </Data></Cell>
    <Cell><Data ss:Type="String"> Mac</Data></Cell>
    <Cell ss:Index="7"><Data ss:Type="String">Aman Vinayak's first day of work is 07/25/2022. Please activate all NY post accounts and model his account after Gladys Bertrand. Software needed: OneTrust, Gmail, Zoom, Office</Data></Cell>
   </Row>
   <Row>
    <Cell ss:StyleID="s62"><Data ss:Type="DateTime">2022-08-08T00:00:00.000</Data></Cell>
    <Cell><Data ss:Type="String">N/A</Data></Cell>
    <Cell><Data ss:Type="String">Pedro Reyes </Data></Cell>
    <Cell><Data ss:Type="String"> preyes@nypost.com </Data></Cell>
    <Cell><Data ss:Type="String"> Mac</Data></Cell>
    <Cell ss:Index="7"><Data ss:Type="String">Pedro Reyes first day of work is 08/08/2022. Please activate all NY Post accounts and model his account after Rosalie Webster or Samantha Donsky (former employee). Software needed: Microsoft Office</Data></Cell>
   </Row>
   <Row>
    <Cell ss:StyleID="s62"><Data ss:Type="DateTime">2022-08-15T00:00:00.000</Data></Cell>
    <Cell><Data ss:Type="String">SCTASK0190592\SCTASK0190571</Data></Cell>
    <Cell><Data ss:Type="String">Nadine Bourne </Data></Cell>
    <Cell><Data ss:Type="String"> nbourne@nypost.com </Data></Cell>
    <Cell><Data ss:Type="String"> Mac</Data></Cell>
    <Cell ss:StyleID="s62"><Data ss:Type="DateTime">2022-08-15T00:00:00.000</Data></Cell>
    <Cell><Data ss:Type="String">Nadine Bourne's first day is 08/15/2022 - Software needed: Methode/Citirx, Merlin, Adobe Photoshop - Please activate all NY post accounts and model after Andrew Battifarano -  (Email sent 08-15-2022).</Data></Cell>
   </Row>
   <Row>
    <Cell ss:StyleID="s62"><Data ss:Type="DateTime">2022-08-15T00:00:00.000</Data></Cell>
    <Cell><Data ss:Type="String">N/A</Data></Cell>
    <Cell><Data ss:Type="String">Matthew Sedacca </Data></Cell>
    <Cell><Data ss:Type="String"> msedacca@nypost.com</Data></Cell>
    <Cell ss:Index="7"><Data ss:Type="String">Matthew Sedacca's transition day is 08/15/2022. Please give him access to all NY Post accounts.  - He was a trial transitioning into a Part Timer so no need for equipment/new softwares. </Data></Cell>
   </Row>
   <Row>
    <Cell ss:StyleID="s62"><Data ss:Type="DateTime">2022-08-22T00:00:00.000</Data></Cell>
    <Cell><Data ss:Type="String">SCTASK0194485</Data></Cell>
    <Cell><Data ss:Type="String">Cathy Burke </Data></Cell>
    <Cell><Data ss:Type="String"> cburke@nypost.com</Data></Cell>
    <Cell ss:Index="6" ss:StyleID="s62"><Data ss:Type="DateTime">2022-08-22T00:00:00.000</Data></Cell>
    <Cell><Data ss:Type="String">Cathy Burke's first day of work will be 8/22/2022. Please activate all NYP accounts and model after Lia Eustachewich. Software needed: Methode, Microsoft Office</Data></Cell>
   </Row>
   <Row>
    <Cell ss:StyleID="s62"><Data ss:Type="DateTime">2022-08-22T00:00:00.000</Data></Cell>
    <Cell><Data ss:Type="String">SCTASK0194485</Data></Cell>
    <Cell><Data ss:Type="String">Matthew Abrahams </Data></Cell>
    <Cell><Data ss:Type="String"> MAbrahams@nypost.com</Data></Cell>
    <Cell ss:Index="6" ss:StyleID="s62"><Data ss:Type="DateTime">2022-08-22T00:00:00.000</Data></Cell>
    <Cell><Data ss:Type="String">Matt Abraham's first day is 8/22/22. Please activate all nypost accounts and model after Joe Illuzzi.  For software, Methode, Slack.</Data></Cell>
   </Row>
   <Row>
    <Cell ss:StyleID="s62"><Data ss:Type="DateTime">2022-08-29T00:00:00.000</Data></Cell>
    <Cell><Data ss:Type="String">SCTASK0197914</Data></Cell>
    <Cell><Data ss:Type="String">Julie Fuschetti </Data></Cell>
    <Cell><Data ss:Type="String"> jfuschetti@nypost.com</Data></Cell>
    <Cell ss:Index="6" ss:StyleID="s62"><Data ss:Type="DateTime">2022-08-29T00:00:00.000</Data></Cell>
    <Cell><Data ss:Type="String">Julie Fuschetti's first day is 8/29/22. Please activate all nypost accounts and model after Ryan Murphy. For software, Adobe Photoshop, Microsoft Office. (Email sent 08-29-2022)</Data></Cell>
   </Row>
   <Row>
    <Cell ss:StyleID="s62"><Data ss:Type="DateTime">2022-09-06T00:00:00.000</Data></Cell>
    <Cell><Data ss:Type="String">SCTASK0202023</Data></Cell>
    <Cell><Data ss:Type="String">Nicole Cukingnan </Data></Cell>
    <Cell><Data ss:Type="String"> (ncukingnan@nypost.com)</Data></Cell>
    <Cell ss:Index="6" ss:StyleID="s62"><Data ss:Type="DateTime">2022-09-06T00:00:00.000</Data></Cell>
    <Cell><Data ss:Type="String">Nicole Cukingnan's first day is 9/6/2022. Please activate all nypost accounts and model after Mike King. For software, adobe photoshop, slack, frame, jw player, vidiq. (09-06-2022).</Data></Cell>
   </Row>
   <Row>
    <Cell ss:StyleID="s62"><Data ss:Type="DateTime">2022-09-06T00:00:00.000</Data></Cell>
    <Cell><Data ss:Type="String">SCTASK0202052</Data></Cell>
    <Cell><Data ss:Type="String">Andrew Tillett </Data></Cell>
    <Cell><Data ss:Type="String"> atillett@nypost.com </Data></Cell>
    <Cell><Data ss:Type="String"> PC</Data></Cell>
    <Cell ss:StyleID="s62"><Data ss:Type="DateTime">2022-09-06T00:00:00.000</Data></Cell>
    <Cell><Data ss:Type="String">Andrew Tillett's first day is 9/6/2022. Please activate all nypost accounts and model after Lia Eustachewich. For softwares, he'll need Methode, Microsoft Office. (Email sent 09-06-2022).</Data></Cell>
   </Row>
   <Row>
    <Cell ss:StyleID="s62"><Data ss:Type="DateTime">2022-08-22T00:00:00.000</Data></Cell>
    <Cell><Data ss:Type="String">N/A</Data></Cell>
    <Cell><Data ss:Type="String">Jaquira Truesdale </Data></Cell>
    <Cell><Data ss:Type="String"> (jtruesdale@nypost.com)</Data></Cell>
    <Cell ss:Index="7"><Data ss:Type="String">Jaquira Truesdale is being converted to a full-time employee on 8/22. Please make her primary email address jtruesdale@nypost.com and model after Pedro Reyes. For softwares, Microsoft Office.</Data></Cell>
   </Row>
   <Row>
    <Cell ss:StyleID="s62"><Data ss:Type="DateTime">2022-09-06T00:00:00.000</Data></Cell>
    <Cell><Data ss:Type="String">SCTASK0202979\SCTASK0202963</Data></Cell>
    <Cell><Data ss:Type="String">Nicholas McEntyre </Data></Cell>
    <Cell><Data ss:Type="String"> (nmcentyre@nypost.com) </Data></Cell>
    <Cell><Data ss:Type="String"> Mac</Data></Cell>
    <Cell ss:StyleID="s62"><Data ss:Type="DateTime">2022-09-06T00:00:00.000</Data></Cell>
    <Cell><Data ss:Type="String">Nicholas McEntyre is starting on 9/6/2022. Please activate all nypost accounts and model after Alec Gearty. For softwares, Merlin, Adobe Photoshop. (Email sent 09-07-2022)</Data></Cell>
   </Row>
   <Row>
    <Cell ss:StyleID="s62"><Data ss:Type="DateTime">2022-09-06T00:00:00.000</Data></Cell>
    <Cell><Data ss:Type="String">SCTASK0202979\SCTASK0202965</Data></Cell>
    <Cell><Data ss:Type="String">Ray Lewis </Data></Cell>
    <Cell><Data ss:Type="String"> rlewis@nypost.com </Data></Cell>
    <Cell><Data ss:Type="String"> Mac</Data></Cell>
    <Cell ss:StyleID="s62"><Data ss:Type="DateTime">2022-09-06T00:00:00.000</Data></Cell>
    <Cell><Data ss:Type="String">Ray Lewis is starting on 9/6/2022. Please activate all nypost accounts and model after Alec Gearty. For softwares, Merlin, Adobe Photoshop. (Email sent 09-07-2022)</Data></Cell>
   </Row>
   <Row>
    <Cell ss:StyleID="s62"><Data ss:Type="DateTime">2022-09-12T00:00:00.000</Data></Cell>
    <Cell><Data ss:Type="String">N/A</Data></Cell>
    <Cell><Data ss:Type="String">Valentina Jaramillo </Data></Cell>
    <Cell><Data ss:Type="String"> vjaramillo@nypost.com </Data></Cell>
    <Cell><Data ss:Type="String"> PC</Data></Cell>
    <Cell ss:Index="7"><Data ss:Type="String">Valentina Jaramillo is converting over to PT on 9/12/22. Please update her email to reflect vjaramillo@nypost.com and model after Jules Corderoy. She'll need a Dell Latitude 5420 and Microsoft Office.</Data></Cell>
   </Row>
   <Row>
    <Cell ss:StyleID="s62"><Data ss:Type="DateTime">2022-09-12T00:00:00.000</Data></Cell>
    <Cell><Data ss:Type="String">SCTASK0210516</Data></Cell>
    <Cell><Data ss:Type="String">Max Weisman </Data></Cell>
    <Cell><Data ss:Type="String"> mweisman.intern@nypost.com</Data></Cell>
    <Cell ss:Index="6" ss:StyleID="s62"><Data ss:Type="DateTime">2022-09-20T00:00:00.000</Data></Cell>
    <Cell><Data ss:Type="String">From MS Excel Spreadsheet - Methods, Wordpress, office </Data></Cell>
   </Row>
   <Row>
    <Cell ss:StyleID="s62"><Data ss:Type="DateTime">2022-09-12T00:00:00.000</Data></Cell>
    <Cell><Data ss:Type="String">SCTASK0205817</Data></Cell>
    <Cell><Data ss:Type="String">Claire Waheed </Data></Cell>
    <Cell><Data ss:Type="String"> cwaheed.intern@decider.com</Data></Cell>
    <Cell ss:Index="6" ss:StyleID="s62"><Data ss:Type="DateTime">2022-09-12T00:00:00.000</Data></Cell>
    <Cell><Data ss:Type="String">Office, Slack Photoshop, Gif Brewery</Data></Cell>
   </Row>
   <Row>
    <Cell ss:StyleID="s62"><Data ss:Type="DateTime">2022-09-12T00:00:00.000</Data></Cell>
    <Cell><Data ss:Type="String">SCTASK0205834</Data></Cell>
    <Cell><Data ss:Type="String">Mara Kleinberg </Data></Cell>
    <Cell><Data ss:Type="String"> mkleinberg.intern@decider.com</Data></Cell>
    <Cell ss:Index="6" ss:StyleID="s62"><Data ss:Type="DateTime">2022-09-12T00:00:00.000</Data></Cell>
    <Cell><Data ss:Type="String">Office, Slack Photoshop, Gif Brewery</Data></Cell>
   </Row>
   <Row>
    <Cell ss:StyleID="s62"><Data ss:Type="DateTime">2022-09-12T00:00:00.000</Data></Cell>
    <Cell><Data ss:Type="String">SCTASK0205865</Data></Cell>
    <Cell><Data ss:Type="String">Amelia Brennan </Data></Cell>
    <Cell><Data ss:Type="String"> abrennan.intern@decider.com</Data></Cell>
    <Cell ss:Index="6" ss:StyleID="s62"><Data ss:Type="DateTime">2022-09-12T00:00:00.000</Data></Cell>
    <Cell><Data ss:Type="String">SLACK, ADOBE PHOTOSHOP, ADOBE PREMIERE, GIF BREWERY, KEEPER</Data></Cell>
   </Row>
   <Row>
    <Cell ss:StyleID="s62"><Data ss:Type="DateTime">2022-09-12T00:00:00.000</Data></Cell>
    <Cell><Data ss:Type="String">SCTASK0205838</Data></Cell>
    <Cell><Data ss:Type="String">Jake Garbar </Data></Cell>
    <Cell><Data ss:Type="String"> jgarbar.intern@nypost.com</Data></Cell>
    <Cell ss:Index="6" ss:StyleID="s62"><Data ss:Type="DateTime">2022-09-12T00:00:00.000</Data></Cell>
    <Cell><Data ss:Type="String">Photoshop, Microsoft Office</Data></Cell>
   </Row>
   <Row>
    <Cell ss:StyleID="s62"><Data ss:Type="DateTime">2022-09-12T00:00:00.000</Data></Cell>
    <Cell><Data ss:Type="String">SCTASK0205730\SCTASK0205807</Data></Cell>
    <Cell><Data ss:Type="String">Brittney Najar </Data></Cell>
    <Cell><Data ss:Type="String"> bnajar@nypost.com </Data></Cell>
    <Cell><Data ss:Type="String"> Mac</Data></Cell>
    <Cell ss:StyleID="s62"><Data ss:Type="DateTime">2022-09-12T00:00:00.000</Data></Cell>
    <Cell><Data ss:Type="String">Brittney Najar's first day is 9/12/22. - Please activate all nypost accounts and model after Gordon Donovan - For softwares, she'll need methode, merlin, photoshop. She'll need Macbook Pro 13&quot;. (Email Sent Out - 09-12-2022).</Data></Cell>
   </Row>
   <Row>
    <Cell ss:StyleID="s62"><Data ss:Type="DateTime">2022-09-19T00:00:00.000</Data></Cell>
    <Cell><Data ss:Type="String">SCTASK0209677</Data></Cell>
    <Cell><Data ss:Type="String">Raven Brunner </Data></Cell>
    <Cell><Data ss:Type="String"> rbrunner@decider.com </Data></Cell>
    <Cell><Data ss:Type="String"> Mac</Data></Cell>
    <Cell ss:StyleID="s62"><Data ss:Type="DateTime">2022-09-19T00:00:00.000</Data></Cell>
    <Cell><Data ss:Type="String">Raven Brunner's first day is 9/19. Please activate all accounts and model after Greta Bjornson. For softwares, she'll need Office, Slack, Photoshop, gif brewery. She'll need Macbook Air 13&quot; - (Email Sent Out - 09-19-2022).</Data></Cell>
   </Row>
   <Row>
    <Cell ss:StyleID="s62"><Data ss:Type="DateTime">2022-09-19T00:00:00.000</Data></Cell>
    <Cell><Data ss:Type="String">SCTASK0209681</Data></Cell>
    <Cell><Data ss:Type="String">Hannah Southwick </Data></Cell>
    <Cell><Data ss:Type="String"> hsouthwick@nypost.com </Data></Cell>
    <Cell><Data ss:Type="String"> Mac</Data></Cell>
    <Cell ss:StyleID="s62"><Data ss:Type="DateTime">2022-09-19T00:00:00.000</Data></Cell>
    <Cell><Data ss:Type="String">Hannah Southwick's first day back is 9/19/22. Please activate all nypost accounts and model after Sophie Cannon. For equipment, she'll need Macbook Air 13&quot;. For softwares, Adobe Photoshop. (Email Sent Out - 09-19-2022).</Data></Cell>
   </Row>
   <Row>
    <Cell ss:StyleID="s62"><Data ss:Type="DateTime">2022-09-19T00:00:00.000</Data></Cell>
    <Cell><Data ss:Type="String">SCTASK0209746</Data></Cell>
    <Cell><Data ss:Type="String">Georgia Worrell </Data></Cell>
    <Cell><Data ss:Type="String"> gworrell@nypost.com </Data></Cell>
    <Cell><Data ss:Type="String"> PC</Data></Cell>
    <Cell ss:StyleID="s62"><Data ss:Type="DateTime">2022-09-19T00:00:00.000</Data></Cell>
    <Cell><Data ss:Type="String">Georgia Worrell will be attending orientation on 9/19. Please activate all nypost accounts and model after Griffin Kelly. For softwares, she'll need Methode, Airtable, Slack, Wordpress, Gmail. (Dell Latitude 5420) - (Email Sent Out - 09-19-2022).</Data></Cell>
   </Row>
   <Row>
    <Cell ss:StyleID="s62"><Data ss:Type="DateTime">2022-09-26T00:00:00.000</Data></Cell>
    <Cell><Data ss:Type="String">SCTASK0213595</Data></Cell>
    <Cell><Data ss:Type="String">Ella Zeiler </Data></Cell>
    <Cell><Data ss:Type="String"> ezeiler@nypost.com </Data></Cell>
    <Cell><Data ss:Type="String"> Mac</Data></Cell>
    <Cell ss:StyleID="s62"><Data ss:Type="DateTime">2022-09-19T00:00:00.000</Data></Cell>
    <Cell><Data ss:Type="String">Ella Zeiler's first day is 9/26/22. Please activate all nypost accounts and model after Allison Underhill. She'll need a Macbook Pro 13&quot; and photoshop. (09-26-2022)</Data></Cell>
   </Row>
   <Row>
    <Cell ss:StyleID="s62"><Data ss:Type="DateTime">2022-09-26T00:00:00.000</Data></Cell>
    <Cell><Data ss:Type="String">SCTASK0213577\SCTASK0213584</Data></Cell>
    <Cell><Data ss:Type="String">Caitlin Doornbos </Data></Cell>
    <Cell><Data ss:Type="String"> cdoornbos@nypost.com </Data></Cell>
    <Cell><Data ss:Type="String"> Mac</Data></Cell>
    <Cell ss:StyleID="s62"><Data ss:Type="DateTime">2022-09-26T00:00:00.000</Data></Cell>
    <Cell><Data ss:Type="String">Caitlin Doornbos is starting on 9/26/22. Please activate all nypost accounts and model after Steven Nelson. For softwares, Methode, Merlin, Adobe Photoshop, Microsoft Office. (09-26-2022).</Data></Cell>
   </Row>
   <Row>
    <Cell ss:StyleID="s62"><Data ss:Type="DateTime">2022-10-03T00:00:00.000</Data></Cell>
    <Cell><Data ss:Type="String">SCTASK0218332</Data></Cell>
    <Cell><Data ss:Type="String">Colin Loughran </Data></Cell>
    <Cell><Data ss:Type="String"> cloughran.intern@nypost.com </Data></Cell>
    <Cell><Data ss:Type="String"> PC</Data></Cell>
    <Cell ss:StyleID="s62"><Data ss:Type="DateTime">2022-10-03T00:00:00.000</Data></Cell>
    <Cell><Data ss:Type="String">Colin Loughran's first day is 10/3/22. Please activate all nypost accounts and model Max Weisman. For softwares, Methods, Wordpress, office. (10-03-2022)</Data></Cell>
   </Row>
   <Row>
    <Cell ss:StyleID="s62"><Data ss:Type="DateTime">2022-10-10T00:00:00.000</Data></Cell>
    <Cell><Data ss:Type="String">SCTASK0224020</Data></Cell>
    <Cell><Data ss:Type="String">Victor Nava </Data></Cell>
    <Cell><Data ss:Type="String"> vnava@nypost.com </Data></Cell>
    <Cell><Data ss:Type="String"> Mac</Data></Cell>
    <Cell ss:StyleID="s62"><Data ss:Type="DateTime">2022-10-10T00:00:00.000</Data></Cell>
    <Cell><Data ss:Type="String">Victor Nava's first day is 10/10/22. Please activate all nypost accounts and model after Neil Sloane. For softwares, please give him the same ones that are assigned to Neil Sloane and Sam Chamberlain. (Email sent out - 10-10-2022)</Data></Cell>
   </Row>
   <Row>
    <Cell ss:StyleID="s62"><Data ss:Type="DateTime">2022-10-10T00:00:00.000</Data></Cell>
    <Cell><Data ss:Type="String">SCTASK0224020</Data></Cell>
    <Cell><Data ss:Type="String">Isabel Keane </Data></Cell>
    <Cell><Data ss:Type="String"> ikeane@nypost.com </Data></Cell>
    <Cell><Data ss:Type="String"> PC</Data></Cell>
    <Cell ss:StyleID="s62"><Data ss:Type="DateTime">2022-10-10T00:00:00.000</Data></Cell>
    <Cell><Data ss:Type="String">She'll need Dell Latitude 5420. For softwares, Methode, Microsoft Office. (Email sent out - 10-10-2022)</Data></Cell>
   </Row>
   <Row>
    <Cell ss:StyleID="s62"><Data ss:Type="DateTime">2022-10-10T00:00:00.000</Data></Cell>
    <Cell><Data ss:Type="String">SCTASK0224034</Data></Cell>
    <Cell><Data ss:Type="String">Matt Levy </Data></Cell>
    <Cell><Data ss:Type="String"> MatthewLevy@nypost </Data></Cell>
    <Cell><Data ss:Type="String"> Mac</Data></Cell>
    <Cell ss:StyleID="s62"><Data ss:Type="DateTime">2022-10-10T00:00:00.000</Data></Cell>
    <Cell><Data ss:Type="String">Matt Levy's first day is 10/10/22. Please activate all nypost accounts and model after Victoria Giardina. For equipment, he'll need Macbook Air 13&quot;. For softwares, he'll need Adobe Photoshop. (Email sent out - 10-10-2022)</Data></Cell>
   </Row>
   <Row>
    <Cell ss:StyleID="s62"><Data ss:Type="DateTime">2022-10-10T00:00:00.000</Data></Cell>
    <Cell><Data ss:Type="String">SCTASK0224038</Data></Cell>
    <Cell><Data ss:Type="String">P.J. McCormick </Data></Cell>
    <Cell><Data ss:Type="String"> pmccormick@nypost.com </Data></Cell>
    <Cell><Data ss:Type="String"> Mac</Data></Cell>
    <Cell ss:StyleID="s62"><Data ss:Type="DateTime">2022-10-10T00:00:00.000</Data></Cell>
    <Cell><Data ss:Type="String">P.J. McCormick's first day is 10/10/22. Please activate all nypost accounts and model after Victoria Giardina. For software, Adobe Photoshop. (Email sent out - 10-10-2022)</Data></Cell>
   </Row>
   <Row>
    <Cell ss:StyleID="s62"><Data ss:Type="DateTime">2022-10-10T00:00:00.000</Data></Cell>
    <Cell><Data ss:Type="String">N/A</Data></Cell>
    <Cell><Data ss:Type="String">Tracy Swartz </Data></Cell>
    <Cell><Data ss:Type="String"> tswartz@nypost.com </Data></Cell>
    <Cell><Data ss:Type="String"> Mac</Data></Cell>
    <Cell ss:Index="7"><Data ss:Type="String">Please activate all nypost accounts and model after Nadine DeNinno. For equipment, she'll need Macbook Air 13.  For softwares, she'll need AirTable, Slack, WordPress, Keeper (and whatever the new photo archive is called). </Data></Cell>
   </Row>
   <Row>
    <Cell ss:StyleID="s62"><Data ss:Type="DateTime">2022-10-10T00:00:00.000</Data></Cell>
    <Cell><Data ss:Type="String">SCTASK0224101</Data></Cell>
    <Cell><Data ss:Type="String">Ralph Semilla </Data></Cell>
    <Cell><Data ss:Type="String"> rsemilla@nypost.com </Data></Cell>
    <Cell><Data ss:Type="String"> Mac</Data></Cell>
    <Cell ss:StyleID="s62"><Data ss:Type="DateTime">2022-10-10T00:00:00.000</Data></Cell>
    <Cell><Data ss:Type="String">Ralph Semilla's first day is 10/10/22. For softwares, he needs adobe premiere, photoshop, slack, dropbox for video team, zoom with local recording for video team. Please model after Thomas Hogan. (Email sent out - 10-10-2022) </Data></Cell>
   </Row>
   <Row>
    <Cell ss:StyleID="s62"><Data ss:Type="DateTime">2022-10-24T00:00:00.000</Data></Cell>
    <Cell><Data ss:Type="String">SCTASK0231495\SCTASK0231497</Data></Cell>
    <Cell><Data ss:Type="String">Amy Hartmann </Data></Cell>
    <Cell><Data ss:Type="String"> ahartmann@nypost.com </Data></Cell>
    <Cell><Data ss:Type="String"> Mac</Data></Cell>
    <Cell ss:StyleID="s62"><Data ss:Type="DateTime">2022-10-24T00:00:00.000</Data></Cell>
    <Cell><Data ss:Type="String">Amy Hartmann's first day is 10/24/22. Please activate all nypost accounts and model after Evelyn Cordon.&#160;For softwares, Merlin, Methode, Photoshop, Bridge. (10-24-2022)</Data></Cell>
   </Row>
   <Row>
    <Cell ss:StyleID="s62"><Data ss:Type="DateTime">2022-10-24T00:00:00.000</Data></Cell>
    <Cell><Data ss:Type="String">SCTASK0231495\SCTASK0231504</Data></Cell>
    <Cell><Data ss:Type="String">Dylan Svoboda </Data></Cell>
    <Cell><Data ss:Type="String"> dsvoboda@nypost.com </Data></Cell>
    <Cell><Data ss:Type="String"> Mac</Data></Cell>
    <Cell ss:StyleID="s62"><Data ss:Type="DateTime">2022-10-24T00:00:00.000</Data></Cell>
    <Cell><Data ss:Type="String">Dylan Svoboda's first day is 10/24/22. Please activate all nypost accounts and model after Michael Blinn.&#160;He needs a Macbook Air 13&quot;. For software, Methode, Merlin, Photoshop. (10-24-2022)</Data></Cell>
   </Row>
   <Row>
    <Cell ss:StyleID="s62"><Data ss:Type="DateTime">2022-10-31T00:00:00.000</Data></Cell>
    <Cell><Data ss:Type="String">SCTASK0234559\SCTASK0234560</Data></Cell>
    <Cell><Data ss:Type="String">Farrah Julin </Data></Cell>
    <Cell><Data ss:Type="String"> fjulin@nypost.com </Data></Cell>
    <Cell><Data ss:Type="String"> Mac</Data></Cell>
    <Cell ss:Index="7"><Data ss:Type="String">Farrah Julin's first day is 10/31/22. Please activate all nypost accounts and model after Tori Schneebaum. For softwares, she'll need Methode, Merlin, Adobe Photoshop. (Email send - 10-31-2022)</Data></Cell>
   </Row>
   <Row>
    <Cell ss:StyleID="s62"><Data ss:Type="DateTime">2022-10-31T00:00:00.000</Data></Cell>
    <Cell><Data ss:Type="String">SCTASK0234559\SCTASK0234563</Data></Cell>
    <Cell><Data ss:Type="String">Tom Roarty </Data></Cell>
    <Cell><Data ss:Type="String"> troarty@nypost.com </Data></Cell>
    <Cell><Data ss:Type="String"> Mac</Data></Cell>
    <Cell ss:Index="7"><Data ss:Type="String">Tom Roarty is starting on 10/31/22. Please activate all nypost accounts and model after Gordon Donovan.&#160;Methode, Merlin, Photoshop.  (10-31-2022)</Data></Cell>
   </Row>
   <Row>
    <Cell ss:StyleID="s62"><Data ss:Type="DateTime">2022-11-06T00:00:00.000</Data></Cell>
    <Cell><Data ss:Type="String">SCTASK0239939\SCTASK0239963</Data></Cell>
    <Cell><Data ss:Type="String">Suzanne Popadin </Data></Cell>
    <Cell><Data ss:Type="String"> spopadin@nypost.com </Data></Cell>
    <Cell><Data ss:Type="String"> PC</Data></Cell>
    <Cell ss:StyleID="s62"><Data ss:Type="DateTime">2022-11-04T00:00:00.000</Data></Cell>
    <Cell><Data ss:Type="String">Suzanne Popadin's first day is 11/6/22. Please activate all nypost accounts and model after Juan Rodriguez. She'll need Dell Latitude 5420, Methode (for print publishing), Merlin, Photoshop, Indesign. - Email sent 11-04-2022)</Data></Cell>
   </Row>
   <Row>
    <Cell ss:StyleID="s62"><Data ss:Type="DateTime">2022-11-09T00:00:00.000</Data></Cell>
    <Cell><Data ss:Type="String">SCTASK0241350</Data></Cell>
    <Cell><Data ss:Type="String">Tamantha Ryan </Data></Cell>
    <Cell><Data ss:Type="String"> tryan@nypost.com </Data></Cell>
    <Cell><Data ss:Type="String"> Mac</Data></Cell>
    <Cell ss:StyleID="s62"><Data ss:Type="DateTime">2022-11-04T00:00:00.000</Data></Cell>
    <Cell><Data ss:Type="String">Tamantha Ryan's first day is 11/9/22. Please activate all nypost accounts and model after Lindsey Kupfer. She'll need Macbook Air 13&quot;, Photoshop, Airtable, Slack, Microsoft Office, CHP, Zoom. -(Emailed - 11-09-2022)</Data></Cell>
   </Row>
   <Row>
    <Cell ss:StyleID="s62"><Data ss:Type="DateTime">2022-11-08T00:00:00.000</Data></Cell>
    <Cell><Data ss:Type="String">SCTASK0240492</Data></Cell>
    <Cell><Data ss:Type="String">Jacob Geanous  </Data></Cell>
    <Cell><Data ss:Type="String"> jgeanous@nypost.com </Data></Cell>
    <Cell><Data ss:Type="String"> PC</Data></Cell>
    <Cell ss:StyleID="s62"><Data ss:Type="DateTime">2022-11-08T00:00:00.000</Data></Cell>
    <Cell><Data ss:Type="String">Jacob Geanous' first day is 11/8/22. Please activate all nypost accounts and model after Matthew Sedacca. For softwares, methode, merlin, airtable, slack, email, wordpress. (11-08-2022)</Data></Cell>
   </Row>
   <Row>
    <Cell ss:StyleID="s62"><Data ss:Type="DateTime">2022-11-21T00:00:00.000</Data></Cell>
    <Cell><Data ss:Type="String">N/A</Data></Cell>
    <Cell><Data ss:Type="String">Lexi Porigow </Data></Cell>
    <Cell><Data ss:Type="String"> lporigow@nypost.com  </Data></Cell>
    <Cell><Data ss:Type="String"> Mac</Data></Cell>
    <Cell ss:Index="7"><Data ss:Type="String">Lexi Porigow's start date is 11/21/22. Please activate all nypost accounts and model after Curt Schwarzkopf. She needs a Macbook Air 13&quot;, Wireless mouse and keyboard for office use, and Microsoft Office.</Data></Cell>
   </Row>
   <Row>
    <Cell ss:StyleID="s62"><Data ss:Type="DateTime">2022-11-28T00:00:00.000</Data></Cell>
    <Cell><Data ss:Type="String">N/A</Data></Cell>
    <Cell><Data ss:Type="String">Saloni Kankaria </Data></Cell>
    <Cell><Data ss:Type="String"> skankaria@nypost.com </Data></Cell>
    <Cell><Data ss:Type="String"> Mac</Data></Cell>
    <Cell ss:Index="7"><Data ss:Type="String">Saloni Kankaria's first day is 11/28/2022. Please activate all nypost accounts and model after Alex Talbert. She'll need Macbook Air 13&quot;, Monitor, keyboard, mouse for office use, Asana, Google Workspace, One Trust, Zoom. </Data></Cell>
   </Row>
   <Row>
    <Cell ss:StyleID="s62"><Data ss:Type="DateTime">2022-11-14T00:00:00.000</Data></Cell>
    <Cell><Data ss:Type="String">SCTASK0243842\SCTASK0244943</Data></Cell>
    <Cell><Data ss:Type="String">Bryan Fonseca </Data></Cell>
    <Cell><Data ss:Type="String"> BFonseca@nypost </Data></Cell>
    <Cell><Data ss:Type="String"> Mac</Data></Cell>
    <Cell ss:StyleID="s62"><Data ss:Type="DateTime">2022-11-14T00:00:00.000</Data></Cell>
    <Cell><Data ss:Type="String">Bryan Fonseca's first day is 11/14/22. Please activate all nypost accounts and model after Michael Blinn. He'll need Macbook Air 13&quot;, Methode, and Photoshop.&#160;(11-14-2022)</Data></Cell>
   </Row>
   <Row>
    <Cell ss:StyleID="s62"><Data ss:Type="DateTime">2022-11-28T00:00:00.000</Data></Cell>
    <Cell><Data ss:Type="String">SCTASK0248991</Data></Cell>
    <Cell><Data ss:Type="String">Lauren Santiago </Data></Cell>
    <Cell><Data ss:Type="String"> lsantiago@nypost.com </Data></Cell>
    <Cell><Data ss:Type="String"> Mac</Data></Cell>
    <Cell ss:StyleID="s62"><Data ss:Type="DateTime">2022-11-23T00:00:00.000</Data></Cell>
    <Cell><Data ss:Type="String">Lauren Santiago's first day is 11/28/22. Please activate all nypost accounts and model after Ryan Sampson/Thomas Hogan. Adobe creative suite, frame.io, slack, jw player.</Data></Cell>
   </Row>
   <Row>
    <Cell ss:StyleID="s62"><Data ss:Type="DateTime">2022-12-05T00:00:00.000</Data></Cell>
    <Cell><Data ss:Type="String">Methode &amp; Merlin were already active\SCTASK0255154</Data></Cell>
    <Cell><Data ss:Type="String">Mark Suleymanov </Data></Cell>
    <Cell><Data ss:Type="String"> msuleymanov@nypost.com</Data></Cell>
    <Cell ss:Index="7"><Data ss:Type="String">Mark Suleymanov's first day back is 12/5/22. Please activate all nypost accounts and model after Alec Gearty. He'll need Macbook Pro 13&quot;, Methode/Citrix, Adobe Photoshop, Microsoft Office, Slack, CHP.</Data></Cell>
   </Row>
   <Row>
    <Cell ss:StyleID="s62"><Data ss:Type="DateTime">2022-12-05T00:00:00.000</Data></Cell>
    <Cell><Data ss:Type="String">SCTASK0255222\SCTASK0255156</Data></Cell>
    <Cell><Data ss:Type="String">Michael McWeeney  </Data></Cell>
    <Cell><Data ss:Type="String"> mmcweeney@nypost.com</Data></Cell>
    <Cell ss:Index="6" ss:StyleID="s62"><Data ss:Type="DateTime">2022-12-06T00:00:00.000</Data></Cell>
    <Cell><Data ss:Type="String"> Please activate all nypost accounts and model after Evelyn Cordon. He'll need a Macbook Pro 13&quot; and Monitor. For softwares, CHP, Methode, Merlin, Photoshop - (12-06-2022)</Data></Cell>
   </Row>
   <Row>
    <Cell ss:StyleID="s62"><Data ss:Type="DateTime">2022-12-18T00:00:00.000</Data></Cell>
    <Cell><Data ss:Type="String">SCTASK0261278</Data></Cell>
    <Cell><Data ss:Type="String">David Scott </Data></Cell>
    <Cell><Data ss:Type="String"> dscott.intern@nypost.com </Data></Cell>
    <Cell><Data ss:Type="String"> PC</Data></Cell>
    <Cell ss:StyleID="s62"><Data ss:Type="DateTime">2022-12-20T00:00:00.000</Data></Cell>
    <Cell><Data ss:Type="String">David Scott's first day is 12/18/22. Please reactivate all nypost accounts. His primary email is dscott.intern@nypost.com. He'll need access to Photoshop PC. No equipment is necessary. - (Email sent 12-20-2022)</Data></Cell>
   </Row>
   <Row>
    <Cell ss:StyleID="s62"><Data ss:Type="DateTime">2022-12-05T00:00:00.000</Data></Cell>
    <Cell><Data ss:Type="String">Phil Chan took care of this request</Data></Cell>
    <Cell><Data ss:Type="String">Maude Campbell </Data></Cell>
    <Cell><Data ss:Type="String"> mcampbell@nypost.com</Data></Cell>
    <Cell ss:Index="6" ss:StyleID="s62"><Data ss:Type="DateTime">2022-12-05T00:00:00.000</Data></Cell>
    <Cell><Data ss:Type="String">She'll need Dell Latitude 5420, Keyboard for in-office. Wired mouse for both office and home, Methode, Okta, Global Protect, Merlin, CHP, Slack, Airtable, Wordpress, MS Word w/macros, gmail, chrome.</Data></Cell>
   </Row>
   <Row>
    <Cell ss:StyleID="s62"><Data ss:Type="DateTime">2022-12-14T00:00:00.000</Data></Cell>
    <Cell><Data ss:Type="String">Jinan Huang took care of this</Data></Cell>
    <Cell><Data ss:Type="String">Lindsey Cherner </Data></Cell>
    <Cell><Data ss:Type="String"> lcherner.consultant@nypost.com</Data></Cell>
    <Cell ss:Index="6" ss:StyleID="s62"><Data ss:Type="DateTime">2022-12-14T00:00:00.000</Data></Cell>
    <Cell><Data ss:Type="String">Can you please&#160;create an NYP&#160; method account for&#160;Lindsey Cherner&#160;you can&#160;model it after&#160;Meenakshi&#160;Krishnan and someone&#160;will need to install Method on her notebook.</Data></Cell>
   </Row>
   <Row>
    <Cell ss:StyleID="s62"><Data ss:Type="DateTime">2022-12-24T00:00:00.000</Data></Cell>
    <Cell><Data ss:Type="String">N/A</Data></Cell>
    <Cell><Data ss:Type="String">Brooke Kato </Data></Cell>
    <Cell><Data ss:Type="String"> bkato@nypost.com</Data></Cell>
    <Cell ss:Index="7"><Data ss:Type="String">She'll need a Macbook Air 13&quot;, Mouse, and Charger. For softwares, she'll need CHP, AirTable, WordPress, Slack, Keeper. Please model after Andrew Court.</Data></Cell>
   </Row>
   <Row>
    <Cell ss:StyleID="s62"><Data ss:Type="DateTime">2023-01-03T00:00:00.000</Data></Cell>
    <Cell><Data ss:Type="String">SCTASK0265383</Data></Cell>
    <Cell><Data ss:Type="String">Everett Jones </Data></Cell>
    <Cell><Data ss:Type="String"> ejones@nypost.com</Data></Cell>
    <Cell ss:Index="6" ss:StyleID="s62"><Data ss:Type="DateTime">2023-01-03T00:00:00.000</Data></Cell>
    <Cell><Data ss:Type="String">He'll need Dell Latitude 5420 and mouse. For softwares, he'll need Methode, Slack, Global Protect, Airtable, Wordpress (Page Six and NYP, live access), gmail.</Data></Cell>
   </Row>
   <Row>
    <Cell ss:StyleID="s62"><Data ss:Type="DateTime">2023-01-03T00:00:00.000</Data></Cell>
    <Cell><Data ss:Type="String">SCTASK0265969\SCTASK0265029</Data></Cell>
    <Cell><Data ss:Type="String">Andrew Crane </Data></Cell>
    <Cell><Data ss:Type="String"> acrane@nypost.com</Data></Cell>
    <Cell ss:Index="6" ss:StyleID="s62"><Data ss:Type="DateTime">2023-01-04T00:00:00.000</Data></Cell>
    <Cell><Data ss:Type="String">Andrew Crane's first day is 1/3/22. Please activate all nypost accounts and model after Jared Schwartz. His primary email should be acrane@nypost.com. - (Emailed Andrew - 01-04-2023).</Data></Cell>
   </Row>
   <Row>
    <Cell ss:StyleID="s62"><Data ss:Type="DateTime">2023-01-03T00:00:00.000</Data></Cell>
    <Cell><Data ss:Type="String">SCTASK0265054</Data></Cell>
    <Cell><Data ss:Type="String">Jane Herz </Data></Cell>
    <Cell><Data ss:Type="String"> jherz@nypost.com</Data></Cell>
    <Cell ss:Index="6" ss:StyleID="s62"><Data ss:Type="DateTime">2023-01-03T00:00:00.000</Data></Cell>
    <Cell><Data ss:Type="String">Jane Herz's first day is 1/3/22. Please activate all nypost accounts and model after Andrew Court. She'll need Macbook Air 13&quot;, Mouse, Charger. For softwares, WordPress, Parsley, AirTable, Slack, CHP, Photoshop, Google Docs.</Data></Cell>
   </Row>
   <Row>
    <Cell ss:StyleID="s62"><Data ss:Type="DateTime">2023-01-09T00:00:00.000</Data></Cell>
    <Cell><Data ss:Type="String">SCTASK0265061</Data></Cell>
    <Cell><Data ss:Type="String">Angela Tricarico </Data></Cell>
    <Cell><Data ss:Type="String"> atricarico@decider.com</Data></Cell>
    <Cell ss:Index="6" ss:StyleID="s62"><Data ss:Type="DateTime">2023-01-03T00:00:00.000</Data></Cell>
    <Cell><Data ss:Type="String">Angela Tricarico's first day is 1/9/2022. Please activate all nypost accounts and model after Sophie Cannon. She'll need a Macbook Air 13&quot;, Monitor, Keyboard, Mouse  for office. For softwares, she'll need Adobe Photoshop, Microsoft Office.</Data></Cell>
   </Row>
   <Row>
    <Cell ss:StyleID="s62"><Data ss:Type="DateTime">2023-01-17T00:00:00.000</Data></Cell>
    <Cell><Data ss:Type="String">SCTASK0266084\SCTASK0265071</Data></Cell>
    <Cell><Data ss:Type="String">Bridget Reilly </Data></Cell>
    <Cell><Data ss:Type="String"> breilly@nypost.com</Data></Cell>
